Text,Language
"welgemanierd heeft het woord suave verschillende oorsprong, maar een zeer interessante oorsprong van het woord is wat aangenaam of zoet smakend voorbeeld betekent.",Dutch
"hij is zo evenwichtig en zacht, vooral in het bijzijn van de dames of barack.",Dutch
Obama is zo zacht en gepolijst nu onthoud wanneer je de volgende keer op een feest bent en je deze persoon ziet die zo is.,Dutch
welgemanierd en gecultiveerd en verfijnd.,Dutch
"vergeet niet te zeggen: wie is die vriendelijke kerel die daar in de hoek is, met dit woord zal je woordenschat meteen toenemen.",Dutch
heel zacht zo slim woord nummer vier is afschuwelijk afschuwelijk het woord afschuwelijk betekent iets heel ergs afschuwelijk verschrikkelijk afschuwelijk aanstootgevend afschuwelijk heeft een Latijnse wortel genaamd.,Dutch
wat betekent angst wreed of verschrikkelijk enkele voorbeelden van het woord afschuwelijk zijn de recente verkrachtingsincidenten in Delhi waren afschuwelijk of gevangenen worden behandeld.,Dutch
op een gruwelijke manier wordt soms in gevangenissen gruwelijk ook in het dagelijks leven gebruikt om over een veelvoorkomend kwaad te praten en dat wil je overdrijven.,Dutch
zijn tafelmanieren waren bijvoorbeeld afschuwelijk of haar gevoel voor kleding is zo afschuwelijk of zijn grammatica is afschuwelijk.,Dutch
dus vergeet niet om de volgende keer dat je op het nieuws over een gruwelijke daad hoort.,Dutch
"opmerken en zeggen dat dit een gruwelijke daad is, slim woord nummer 5 is ontzagwekkend, ontzagwekkend, ontzagwekkend, betekent verbazingwekkend verbazingwekkend.",Dutch
"nu gebruiken we hier vaak het woord geweldig ' s een ander woord dat je kunt gebruiken in plaats van geweldig verbazingwekkend, bijvoorbeeld vandaag heb ik een verbazingwekkende score op mijn test, wat betekent dat ik een zeer hoge score heb gehaald of.",Dutch
ik heb een bijna perfecte score.,Dutch
Het woord verbazingwekkend heeft klassieke Latijnse wortels van het woord dat betekent.,Dutch
"verbluft zijn zo ontzagwekkend wordt gebruikt om iets te beschrijven dat verbluffend goed is, ze ziet er bijvoorbeeld ontzagwekkend uit in die jurk of wat een geweldig uitzicht vanaf dit balkon of ik lees dit ontzagwekkende boek dat ik niet kan neerleggen hoe zit het met jou en vertellen.",Dutch
"je vrienden, dat is dit geweldige kanaal voor studenten en sommige andere woorden die je kunt gebruiken in plaats van verbluffend zijn ongelooflijk fantastisch of uitzonderlijk goed, oké, dus voordat we verder gaan met de uitgebalanceerde vijf woorden op deze video, vergeet dan niet om een ​​opmerking onder deze video te plaatsen.",Dutch
om me te vertellen welk van deze tien woorden je favoriete slimme woord was nummer zes zit in een fix in een fix betekent dat je in een lastige situatie verkeert bijvoorbeeld jongen ik zit in een moeilijke situatie omdat ik hier met twee verschillende vrienden plannen voor heb gemaakt avond.,Dutch
"ik ben mijn telefoon kwijt en ik zit in de problemen of onze bus is vanmorgen kapot gegaan en ik zit in de problemen, mijn vriend wendt zich altijd tot mij voor hulp als hij in de problemen zit en als het goed gaat, vergeet hij het.",Dutch
"dus de volgende keer dat je wiskundehuiswerk van school krijgt, bijvoorbeeld en als je je wiskundeboek op school hebt achtergelaten, kun je je vrienden vertellen dat je in een echte situatie zit, nu denk je misschien dat het woord repareren iets te doen heeft met iets repareren.",Dutch
maar nee in een fix betekent dat je in een lastige situatie zit andere woorden die je kunt gebruiken in plaats van in een fix zit ik in een soep of ik ' ik zit in een puinhoop of ik zit in de problemen of ik ben gewoon op een plek slim woord nummer 7 is flummox flummox betekent iemand verwarren.,Dutch
"zo vaak dat ze vergeten wat ze nu moeten doen verward is meestal een te veel gebruikt woord, dus waarom gebruik je geen flummox bijvoorbeeld, de jongen zag er helemaal uit.",Dutch
stomverbaasd toen de leraar hem een ​​vraag stelde in de klas of de hond keek stomverbaasd bij zijn eigen spiegelbeeld in de spiegel of de toerist was in de war door de verschillende gebruiken die.,Dutch
"die hij tegenkwam tijdens zijn reizen of in een interview toen haar werd gevraagd waarom we je zouden inhuren, zag ze er compleet stomverbaasd uit, dus als je de volgende keer in de war raakt over vragen, bijvoorbeeld tijdens een examen, dan jij.",Dutch
kan dat altijd zeggen omdat ik dat niet had gedaan Ik heb me goed voorbereid op het examen.,Dutch
Ik was stomverbaasd door enkele van de vragen.,Dutch
"Andere woorden die je kunt gebruiken in plaats van verward zijn verbijsterd, verbaasd of verbijsterd.",Dutch
"is een heel Franse manier om ontmoeting of datum te zeggen, ik heb bijvoorbeeld een afspraak met mijn vrienden tijdens de lunch op zaterdag of ik ben van plan om met mijn vrienden af ​​te spreken in het winkelcentrum voor films rendez-vous kan zowel als zelfstandig naamwoord of als werkwoord worden gebruikt bijvoorbeeld.",Dutch
ik heb vanavond een afspraak met mijn vrienden of ik ga morgen met mijn vrienden afspreken.,Dutch
"in Frankrijk werd eerdere afspraak door het leger gebruikt om een ​​ontmoetingsplaats voor de troepen aan te duiden, nu is er iets spannends en geheimzinnigs aan het woord rendez-vous, zelfs nu, terwijl je rendez-vous voor elke bijeenkomst kunt gebruiken.",Dutch
"in het algemeen maar het won ' het is erg geschikt voor een officiële vergadering, dus als je een date hebt, kun je misschien zeker noemen dat een rendez-vous slim woord nummer 9 stomp is stomp stomp is een belediging die je zou gebruiken als je iemand dom of ongewild probeert te noemen of domme nu je het woord stomp hebt gehoord in geometrie stompe hoek en scherpe hoek, dus een stompe hoek is een hoek groter dan 90 graden maar kleiner dan 180 graden.",Dutch
en een scherpe hoek is deze scherpe hoek minder dan 90 graden zo scherp als een woord wordt gebruikt om scherp aan te duiden en daarom ook mentaal scherp en stomp is duidt bot en daarom ook een beetje traag in de geest dus voorbeeldzinnen met stomp zijn de man was zo stom dat hij zijn wachtwoord weggaf aan een nep-beller of het stompe kind.,Dutch
was niet in staat.,Dutch
om een ​​enkele vraag op de test te beantwoorden of de stompe man had het moeilijk om zelfs de basisinstructies te begrijpen.,Dutch
"Stel nu dat in uw dagelijkse situatie uw vriend of vriendin boos op u is en u weet niet waarom, dus u kunt.",Dutch
"zeg tegen hen misschien ben ik stom, maar ik weet niet waarom je zo van streek bent.",Dutch
slim woord nummer 10 is traag traag traag betekent om langzaam te bewegen om een ​​beetje langzamer te zijn.,Dutch
dan normaal om er een beetje moe en gebrekkig uit te zien.,Dutch
in energievoorbeeld maakt een zware lunch me erg in de namiddag traag heeft wortels van het woord wat een traag persoon betekent en een naaktslak is een dier dat echt heel langzaam beweegt zoals een slak bijvoorbeeld.,Dutch
de economie was dit jaar erg traag of de wedstrijd werd hervat na een trage start.,Dutch
"of zaken zijn dit kwartaal traag geweest, je kunt het in je dagelijks leven gebruiken als je je op een dag erg moe voelt, dat kan je je moeder vertellen of je kunt het zien.",Dutch
"je vrienden, ik voel me erg traag.",Dutch
"vandaag zou ik kunnen doen met een energiedrank, andere woorden die je kunt gebruiken in plaats van traag, kunnen lusteloos zijn of slepend met mijn voeten, dus dat waren de 10 slimme woorden en eerder.",Dutch
Ik geef je die geheime tip om heel vloeiend te klinken.,Dutch
"Ik wil je eraan herinneren dat als je op zoek bent naar slimme woorden voor een telefoongesprek, ik een link naar een video plaats.",Dutch
daarvoor in het beschrijvingsvak en nu de geheime tip.,Dutch
De geheime tip om vloeiend te klinken is om niet meer dan één slim woord of zin te gebruiken die ik soms ken.,Dutch
we worden erg opgewonden omdat.,Dutch
"wij' Ik heb een heleboel van deze slimme woorden geleerd en we hebben de neiging om er twee, drie, vier in één zin te proppen die niet natuurlijk klinkt.",Dutch
zorg er dus een voor een voor dat je het woord op de juiste manier uitspreekt.,Dutch
"ga naar google en typ het woord en in de zoekopdracht rechtsboven zie je een klein luidsprekerpictogram, klik op die luidspreker.",Dutch
en hoor de uitspraak een of twee keer.,Dutch
"en je bent klaar om te gaan en als je deze video leuk vond, vergeet dan niet om ons een duim omhoog te geven met een opmerking.",Dutch
voor mij eronder om me te vertellen welke van deze 10 woorden je favoriet is en ook.,Dutch
als je nog niet op de abonneerknop en het belpictogram ernaast hebt gedrukt en blij bent met kijken.,Dutch
"hey guys, welkom op mijn kanaal in deze video.",Dutch
Ik ga je de 50 beste Engelse zinnen geven die je in je dagelijks leven kunt gebruiken.,Dutch
dus als u op het punt staat aan uw reis te beginnen.,Dutch
"naar een Engels sprekend land, kunt u dit volledig gebruiken.",Dutch
zinnen als je al een tijdje Engels leert en je wilt hervatten.,Dutch
"dit is de beste video om mee te beginnen, dus laten we in hopelijk 10 minuten 50 zinnen in het Engels bekijken.",Dutch
zin nummer één dit is een andere manier om te vragen.,Dutch
hoe gaat het met jou?,Dutch
hoe gaat het?,Dutch
hoe gaat het?.,Dutch
"dus je ontmoet iemand en je tijd, hoe gaat het ?.",Dutch
"zin nummer twee als je iemand een tijdje niet hebt gezien, vertel je hem een ​​lange tijd niet gezien, dus dat betekent dat je deze persoon misschien weken of maanden niet gezien hebt, zin nummer.",Dutch
drie als je je wilt vragen wat je hebt gedaan.,Dutch
"je vraagt ​​wat je hebt uitgespookt, dus wat gebeurde er in je leven?",Dutch
wat heb je gedaan om ze op te voeden als alles goed gaat?,Dutch
"Nou, je kunt gewoon antwoorden, kan niet klagen dat alles echt gaaf is.",Dutch
"kan niet klagen volgende zin iemand vertelt je iets en je hebt het niet echt in het gesprek genoemd alsof ze op de een of andere manier raden dat je een nieuwe baan hebt, en je vraagt ​​het hem.",Dutch
hoe weet je dat?.,Dutch
"waar heb je het nieuws vandaan, zoals hoe gaat het?",Dutch
"weet dat als iemand een leuke grap vertelt, je kunt zien dat het een goede is.",Dutch
"dat is een geweldige grap, dus de zin is dat het een goede is.",Dutch
"als je iemand wilt bedanken, kun je zeggen dat het erg aardig van je is, heel erg bedankt dat je dat gedaan hebt, dat is erg aardig van je, het is erg aardig van je als iemand.",Dutch
"probeerde u te helpen, maar kon het resultaat dat u kunt zeggen niet bereiken.",Dutch
"toch bedankt het maakt niet uit, maar toch bedankt.",Dutch
bedankt voor de moeite.,Dutch
"nee, toch bedankt, en een andere zin die ik soms in mijn e-mail gebruik als ik niet om een ​​persoon heb gevraagd.",Dutch
vraag ik en dan zeg ik uiteindelijk.,Dutch
"bij voorbaat dank, wat betekent dat ik echt hoop dat je het gaat doen.",Dutch
bedank je bij voorbaat.,Dutch
"bij voorbaat dank als iemand een fout heeft gemaakt, en hij is er echt van streek over.",Dutch
je kunt gewoon geen zorgen zeggen.,Dutch
"maak je geen zorgen, maak je geen zorgen, dus maak je er geen zorgen over.",Dutch
het is goed.,Dutch
"maak je geen zorgen, stel je voor dat je thuiskwam en al je vrienden op je bank zitten.",Dutch
"en je bent net als wat er hier aan de hand is, zoals wat doe je hier ?.",Dutch
wat gebeurt er als je iets niet hebt opgevangen of als het de persoon die je altijd kunt vragen niet begreep of ik je goed heb begrepen ?.,Dutch
"en ga je gang en leg uit waar je vandaan kwam, heb ik je goed begrepen?",Dutch
"als je iemand vraagt ​​om niet van streek te zijn en niet te huilen, kun je zeggen dat je het niet ter harte moet nemen.",Dutch
"neem het niet ter harte, wees niet zo van streek, neem het niet ter harte.",Dutch
"een andere manier om te vragen of je een deel van een zin niet hebt verstaan, kun je zeggen dat ik het laatste woord niet heb verstaan.",Dutch
mijn excuses.,Dutch
kun je het herhalen omdat ik het laatste woord niet heb verstaan ​​als hij wil dat iemand de hele zin opnieuw herhaalt.,Dutch
je kunt sorry zeggen.,Dutch
Ik luisterde niet omdat je het misschien druk had.,Dutch
"misschien was je aan het telefoneren en was er iemand tegen je aan het praten, en je denkt.",Dutch
O mijn God.,Dutch
sorry ik luisterde niet.,Dutch
kan je het herhalen?.,Dutch
mijn excuses.,Dutch
ik luisterde niet naar een andere zin die ik de hele tijd gebruik.,Dutch
"het maakt niet uit, maak je geen zorgen als je je koffie overal bij me neerzet.",Dutch
het is alsof het er niet toe doet.,Dutch
ik red het wel.,Dutch
ik' Ik ga toch naar de was.,Dutch
het maakt niet uit of je iemand geluk wilt wensen.,Dutch
en ik doe altijd dat je vingers gekruist kunt zeggen en je vingers zo kruist.,Dutch
duimen.,Dutch
"een andere uitdrukking die Amerikanen gebruiken is oh slecht, die het verklaart en.",Dutch
"de situatie is dat je iets niet hebt gekregen en dan krijg je een extra effect, en je krijgt het.",Dutch
"en je bent zo van oh dat verklaart het, dat verklaart het.",Dutch
"een andere manier om de persoon te vertellen dat hij niet boos moet zijn, is door te zeggen dat dingen gebeuren alsof het goed is.",Dutch
"er gebeuren dingen, wees niet boos als je niet de naam hebt van een persoon met wie je hem wilt spreken.",Dutch
"je kunt sorry zeggen dat ik je stoor, je weet dat je het ziet.",Dutch
"als iemand het druk heeft, kunt u altijd sorry zeggen dat ik u stoor en dan kunt u het vragen.",Dutch
sorry dat ik je stoor.,Dutch
"als je midden in iets in iemand zit ' Je vraagt ​​je iets wat je kunt zeggen, oh.",Dutch
"je bent ergens middenin en iemand vraagt ​​je iets te doen wat je zegt, het spijt me.",Dutch
ik ben zo bij je ik ben bij je in en dan ga je verder met iets doen en je zegt waar we waren.,Dutch
"zoals wanneer zijn we gestopt waar we waren en je moet het herhalen, want met wat is het geluid waarmee sommige mensen zich vergissen.",Dutch
dus dit is een geweldige manier om te oefenen waar waren we ook alweer als je midden in een gesprek zit?,Dutch
"en je snapte niet wat de andere persoon zei, je kunt wel zeggen dat je het zei en met een vraagteken.",Dutch
wat betekent dat de persoon ertoe aanzet om nogmaals te herhalen?,Dutch
u zei .,Dutch
"als iemand een baan van zijn dromen heeft, of wat je ook kunt zeggen, gelukkig ben jij of iemand de universiteit van zijn dromen binnenstapte als een geluksvogel, dit is een manier om de persoon die je geluk heeft te feliciteren of gewoon te benadrukken dat hij geluk heeft gehad geluk je een andere manier om te zeggen Dat je echt boos bent, is om te zeggen dat ik in paniek raakte alsof ik zo boos was.",Dutch
Ik was bang dat dit super boos is.,Dutch
"oh, dit is bijna gek.",Dutch
"ik schrok van een andere zin die moedertaalsprekers gebruiken, is goed voor je en dit kan zowel positief als negatief zijn als je zegt dat ik promotie heb gemaakt en als ze goed voor je zeggen, zoals felicitaties en soms als je zegt alsof ik deze plek verlaat.",Dutch
"ze zijn als goed voor je, het zou beter zijn zonder jou en dit is een negatieve betekenis, dus luister echt naar de intonatie.",Dutch
"als iets je verrast, kun je ook zeggen dat je me voor de gek houdt, oh mijn god.",Dutch
"Ik kan het niet geloven, je houdt me voor de gek om iemand te vertellen dat hij moet glimlachen en om gelukkig te zijn, kun je altijd zeggen: opbeuren, opkijken.",Dutch
"als je iemand wilt die gewoon klinkt als huilen en klagen over iets dat niet gebeurt, kun je zeggen kom ik ben je kan het doen ik?",Dutch
kom op.,Dutch
"je kunt het doen je kunt de toefl doorgeven je kunt de gmat doorgeven, je krijgt het, kom op.",Dutch
"je kunt het doen als iemand het heel goed doet, je kunt ze vertellen ga zo door met het goede werk ga zo door met het goede werk als wees zo goed als je bent en ga zo door met het goede werk doorgaan met een andere zin is informeel, en dit is wat amerikanen zeggen.",Dutch
"dat is verlicht, wat betekent dat dat verbazingwekkend is, zeiden veel Amerikanen in Californië.",Dutch
"oh dat is verlicht en je hebt het waarschijnlijk gehoord in liedjes die ' Gaat branden als iemand succesvol is na mislukkingen, dus je kunt zeggen dat je gaat ik zei je dat je het gaat redden als iemand je vraagt ​​of je moe bent en je wilt zeggen dat je helemaal niet moe bent kan niet een beetje nah zeggen.",Dutch
"ik wil doorgaan ik ben er niet moe van, niet als iemand je vraagt, weet je het zeker en je bent er vrij zeker van dat je kunt zeggen dat daar geen ruimte voor is?",Dutch
"er is geen ruimte voor twijfel in Amerika of je iemand wilt sms'en of ze een bericht wilt sturen zeg je tekst naar tekst dus ik stuur je een sms betekent dat ik je een bericht zal sturen via whatsapp of een telegram of een boodschapper van wat dan ook, ik zal sms je nog een keer om iemand op te vrolijken en te zeggen dat ze niet boos moeten zijn, je kunt zeggen dat het het niet waard is, zoals waarom huil je?",Dutch
het is het niet waard.,Dutch
je bent zoveel beter dan het probleem waar je om huilt ' Het is je tranen niet waard.,Dutch
"het is het niet waard, ik ben persoonlijk dol op de zin die je rockt, wat betekent dat je geweldig bent.",Dutch
O mijn God.,Dutch
jij rock je rock?,Dutch
"nee, je hebt geweldig werk verricht.",Dutch
"je rockt als iemand niet echt goed werkt, en je wilt dat ze harder werken, je kunt zeggen dat je een extra mijl moet gaan, wat betekent dat je net als harder moet werken, een extra mijl moet doen.",Dutch
"een andere manier om precies hetzelfde te zeggen wat je kunt zeggen: verhoog je spel, zoals harder werken, beter werken, verhoog je spel.",Dutch
als iemand huilt en het niet wil.,Dutch
het zinkt je zegt: trek jezelf bij elkaar alsof je letterlijk jezelf neemt en jezelf bij elkaar brengt stop met werken stop met huilen trek jezelf bij elkaar.,Dutch
hey kalmeer jezelf samen een andere zin dat.,Dutch
ik hou van je verkocht mij omdat mensen soms hun reis beschrijven of iemand die ze kochten en ze beschrijven het zo goed.,Dutch
"en ze zijn alsof ik hetzelfde wil kopen en ik vertel hen dat je het hebt verkocht, je hebt me verkocht.",Dutch
"Ik zou dit niet goed kopen, je hebt me verkocht als je niet geïnteresseerd bent in het gesprek.",Dutch
je houdt van zitten je kunt zeggen dat het me niet kan schelen dit is zo saai.,Dutch
Ik ben niet geïnteresseerd.,Dutch
"Het kan me niet schelen als iemand je iets vraagt ​​en dit is een heel gemakkelijke beslissing voor je, zoals iemand zegt dat je mijn 1 miljoen dollar neemt en je zegt dat dit een no-brainer is.",Dutch
Ik neem het.,Dutch
"dit is een no-brainer, wat betekent dat het een heel gemakkelijke beslissing voor je is als je iets verkeerd hebt gedaan en je geeft toe dat je kunt zeggen dat ik het verpest heb, ja jongens.",Dutch
ik weet.,Dutch
mijn excuses.,Dutch
Ik heb het verpest.,Dutch
dit is mijn fout.,Dutch
"ik heb het verpest ik heb het verpest als je wilt dat iemand in plaats van mij werkt, kun je zeggen.",Dutch
kun je me bedekken zoals kan je werken in plaats van mij terwijl ik ' Ik zie mijn vriend.,Dutch
"kun je me dekken, het is tijd om te vertrekken en jongens, ik kan maar beter gaan, wat betekent dat ik al moet gaan.",Dutch
het is je weet.,Dutch
het is eigenlijk 13.00 uur.,Dutch
direct.,Dutch
Ik kan maar beter op een andere manier afscheid nemen.,Dutch
"ik kan zeggen wees voorzichtig, wat betekent: zorg voor jezelf.",Dutch
Ik zie je later.,Dutch
wees voorzichtig.,Dutch
"ik weet niet op welke dag het is wanneer je deze video bekijkt, maar of het vrijdag is, bijvoorbeeld weekend.",Dutch
je kunt zeggen: godzijdank is vrijdag of denk dat de hemel zaterdag weekendontdekking zei.,Dutch
ik ben zo blij dat dit het was jongens 50 zinnen in het engels laat me weten of dit nuttig was door deze video leuk te vinden en hieronder te reageren als je nog meer coole zinnen kent.,Dutch
"dat zou geweldig zijn, daar ergens een rode knop.",Dutch
Hallo en welkom.,Dutch
in deze video zal ik je 100 veelvoorkomende en zeer nuttige zinnen geven die je in een gesprek kunt gebruiken.,Dutch
als je een zin hoort oefenen om het na mij te zeggen.,Dutch
"probeer mijn uitspraak exact te kopiëren, inclusief de tone of voice die ik gebruik.",Dutch
oke laten we beginnen.,Dutch
basisgroeten hoe gaat het?,Dutch
hoe staat het ermee?,Dutch
hoe gaat het?,Dutch
leuk je te ontmoeten.,Dutch
Dat is lang geleden.,Dutch
hoe was het met je?,Dutch
"geweldig, bedankt.",Dutch
en jij?,Dutch
weinig.,Dutch
het gebruikelijke.,Dutch
ik moet gaan.,Dutch
"het was een genoegen je te ontmoeten, je ziet je later.",Dutch
blijf in contact.,Dutch
vragen naar informatie.,Dutch
kun je me vertellen wat dit woord betekent?,Dutch
zou je toevallig weten waar de bibliotheek is?,Dutch
aarzelend.,Dutch
dat is een goede vraag.,Dutch
even kijken.,Dutch
laat me even nadenken.,Dutch
vraagt ​​om herhaling.,Dutch
pardon?,Dutch
"sorry, dat heb ik niet verstaan.",Dutch
zou je dat willen herhalen?,Dutch
"kan je wat langzamer praten, alstublieft?",Dutch
"zeggen ""ik weet het niet"".",Dutch
Ik ben bang dat ik geen idee heb.,Dutch
"kan je daar niet helpen, sorry.",Dutch
slaat me.,Dutch
meningen.,Dutch
wat denk je daarvan?,Dutch
wat is uw mening hierover?,Dutch
ik denk dat dat een goed idee is.,Dutch
ik denk eerlijk gezegd niet dat het gaat werken.,Dutch
wat mij betreft is dit het beste restaurant van de stad.,Dutch
een vraag vermijden.,Dutch
Ik heb er geen mening over.,Dutch
laat me daar op terugkomen.,Dutch
ik mag het niet zeggen.,Dutch
eens en oneens.,Dutch
ik ben het daar niet meer mee eens.,Dutch
je hebt helemaal gelijk.,Dutch
ik ben het 100% met je eens.,Dutch
je slaat de spijker op zijn kop.,Dutch
ik weet niet zeker of ik het ermee eens ben.,Dutch
ik ben bang dat ik het er niet mee eens ben.,Dutch
Ik denk dat je het mis hebt.,Dutch
beleefd onderbreken.,Dutch
Sorry dat ik u onderbreek.,Dutch
kan ik je daar even stoppen?,Dutch
Vind je het erg als ik hier spring?,Dutch
doe Maar.,Dutch
ga maar door.,Dutch
laat me uitpraten.,Dutch
wacht even.,Dutch
suggesties.,Dutch
wat zeg je dat we naar de film gaan?,Dutch
wat dacht je van pizza eten voor vanavond?,Dutch
dat zou geweldig zijn.,Dutch
klinkt goed.,Dutch
daar ben ik niet zeker van.,Dutch
"nee, ik denk het niet.",Dutch
plannen maken.,Dutch
wat doe je vanavond?,Dutch
heb je plannen voor morgen?,Dutch
ben je aanstaande zaterdag vrij?,Dutch
wil je dit weekend iets doen?,Dutch
"zeker, wat heb je in gedachten?",Dutch
"Ik ben het hele weekend vrij, laten we iets doen.",Dutch
"nee sorry, ik heb al wat plannen gemaakt.",Dutch
Ik heb het morgen druk.,Dutch
"Ik zou graag iets willen doen, maar ik kan het niet.",Dutch
toestemming.,Dutch
vind je het erg als ik je mobiele telefoon gebruik?,Dutch
zou het goed zijn als ik morgen een vrije dag zou nemen?,Dutch
"ja, alsjeblieft, ga je gang.",Dutch
Nee helemaal niet.,Dutch
helaas moet ik nee zeggen.,Dutch
Ik heb liever dat je het niet doet.,Dutch
ik ben bang van wel.,Dutch
verzoeken doen.,Dutch
"mag ik het zout, alstublieft?",Dutch
Zou je me wat geld willen lenen?,Dutch
Ik vroeg me af of je me hiermee kon helpen.,Dutch
zeker geen probleem.,Dutch
Ja natuurlijk.,Dutch
ik help je graag verder.,Dutch
"sorry, ik kan het nu niet.",Dutch
ik ben bang dat ik het niet kan. aanbiedingen doen.,Dutch
kan ik je een glas water geven?,Dutch
wat dacht je van een ijsje?,Dutch
wil je dat ik je een lift naar huis geef?,Dutch
Ja graag.,Dutch
"dat zou geweldig zijn, bedankt.",Dutch
"met mij gaat het goed, maar bedankt voor het aanbieden.",Dutch
"nee, het gaat goed, bedankt.",Dutch
mensen bedanken.,Dutch
hartstikke bedankt.,Dutch
proost ik waardeer het echt.,Dutch
dat is erg aardig van je.,Dutch
ik kan je niet genoeg bedanken.,Dutch
het is niets.,Dutch
noem het niet.,Dutch
elk moment.,Dutch
graag gedaan.,Dutch
iemand vragen om te wachten.,Dutch
"kan je even wachten, alstublieft?",Dutch
wacht een seconde.,Dutch
heb even geduld met mij.,Dutch
Ik kom zo bij je.,Dutch
excuses aanbieden.,Dutch
dat spijt me echt.,Dutch
accepteer mijn excuses.,Dutch
maak je er geen zorgen over.,Dutch
geen zorgen.,Dutch
"oké, als je meer lessen wilt over veelvoorkomende zinnen en woordgroepen, laat het me weten in de comments hieronder.",Dutch
"Ook als je deze video leuk vond, geef hem dan een duim omhoog door op de like-knop te drukken en vergeet niet je op dit kanaal te abonneren door op de abonneerknop te klikken om mijn laatste lessen hier op youtube te krijgen.",Dutch
gelukkig leren en ik zie je binnenkort in een andere les.,Dutch
het gouden brood Er was eens in een klein dorpje een vrouw die Marion heette.,Dutch
"met haar enige dochter was narcisa marion buitengewoon nederig en lieve narcisa was echter helemaal het tegenovergestelde, je ziet dat ze mooi was zonder woorden, ze was als een leven.",Dutch
"pop en het meest grappige is dat ze oneindig veel van zichzelf hield, narcisa zou je.",Dutch
"help me het brood bakken he, mam, de meelmeisjes al mijn heldere en sprankelende ogen.",Dutch
"narcisa wil je me helpen deze zaden te planten wat waarom zou ik dat doen wat heb ik al dat vuil op mijn mooie vingers erger wat als het goed op mijn gezicht ging, dat was het probleem met narcisa.",Dutch
ze vond zichzelf te geweldig om wat voor werk dan ook te doen.,Dutch
Veel vrijers kwamen om narcissen te vragen.,Dutch
"omdat haar schoonheid wijd en zijd bekend was, maar ze ze allemaal heel grof afgewezen, waarom heb je die mannen gisteren weggestuurd, ze leken aardig, je kunt niet serieus zijn, mama een van hen.",Dutch
had zulke kleine ogen bijna als die van een vogel en de ander had een enorme neus dat ik niet bij hem in de buurt zou willen zijn.,Dutch
"toen hij niesde oh oh en de laatste stop nee ik wil niet meer horen, alles wat ik kon zien was dat die mannen echt aardig waren mijn liefste, je moet die schoonheid kennen.",Dutch
is niet alles moeder je moet beseffen dat ik iemand verdien als een prins of een ridder.,Dutch
"oh lieverd op een nacht toen ze sliep, zat haar moeder naast haar en keek naar haar.",Dutch
