Text,Language
"Существуют планы лицензирования торговой марки Википедии для некоторых продуктов, таких, как книги и DVD[44].",Russian
В ноябре 2015 года Википедия получила Премию Эразма[45].,Russian
Пользователи Википедии — это: Участники Википедии образуют сообщество участников Википедии.,Russian
"Структура этого сообщества — иерархическая, то есть это своего рода структура власти[46][47].",Russian
"Участники Википедии с хорошей репутацией в сообществе могут баллотироваться на один из многих уровней добровольного руководства; это начинается с «администратора»[48], самой большой группы привилегированных пользователей (1594 учётных записей в английской Википедии, по состоянию на 30 сентября 2008 года), которые имеют возможность удаления страниц, блокировки статей от изменений в случае вандализма или редакторских споров и блокировки участников.",Russian
"Несмотря на название, администраторы не имеют никаких особенных привилегий в процессе принятия решений, и им запрещено использовать свои полномочия для урегулирования споров.",Russian
"Роли администраторов часто описываются как «уборка» и в основном ограничиваются внесением правок, имеющих эффект в масштабах всего проекта (и поэтому запрещённых для обычных редакторов, чтобы минимизировать нарушения), а также блокировкой пользователей для предотвращения разрушительных правок, таких как вандализм.",Russian
"Поскольку Википедия развивается на основе нетрадиционной модели составления энциклопедии, вопрос «Кто пишет „Википедию“?» стал одним из наиболее часто задаваемых вопросов по проекту, часто со ссылкой на другие проекты Веб 2.0, такие как Digg[49] или, например, News2 и Хабрахабр.",Russian
"Джимми Уэйлс однажды утверждал, что только «сообщество… преданная группа нескольких сотен добровольцев» делает основной вклад в Википедию и что этот проект является поэтому «очень похожим на любую традиционную организацию».",Russian
"Это было позже оспорено Аароном Шварцем, который отметил, что ряд просмотренных им статей имели крупные части содержания, внесёнными участниками с малым количеством правок[50].",Russian
"Исследование учёных из Дартмутского колледжа, проведённое в 2007 году, установило, что анонимы и те пользователи, которые редко делают вклад в Википедию, являются таким же надёжным источником знаний, как и те, которые зарегистрированы на сайте[51].",Russian
"Хотя некоторые участники сильны в своей области, Википедия требует, чтобы даже их вклады были подкреплены опубликованными и поддающимися проверке источниками.",Russian
Это предпочтение консенсуса наличию образования было отмечено как «антиэлитарность»[52].,Russian
"В августе 2007 года сайт, разработанный аспирантом по компьютерным наукам Вирджилом Гриффитом и названный WikiScanner, начал публичное функционирование.",Russian
"WikiScanner прослеживает источники миллионов изменений, произведённых в Википедии анонимными редакторами, и показывает, что многие из этих правок делаются из корпораций или правительственных учреждений в статьях, связанных с ними, их персоналом или их работой, из которых они пытаются удалить критику[53].",Russian
"В 2003 году в исследовании о Википедии как о сообществе студент  Andrea Ciffolilli утверждал, что низкие операционные затраты участия в вики создают катализатор для совместного развития и что подход «творческого развития» поощряет участие[54].",Russian
"В своей книге «Будущее Интернета и как его остановить» 2008 года Jonathan Zittrain из Оксфордского института Интернета и Berkman Center for Internet & Society Гарвардской школы права ссылается на Википедию как социологическое исследование в том, как открытое сотрудничество способствовало инноваторству в Сети[55].",Russian
"В 2007 году исследователь Одед Нов опубликовал работу о мотивации, которой руководствуются википедисты.",Russian
"Нов считает, что участники редактируют Википедию, исходя из следующих видов мотивации: защитной («когда я правлю „Википедию“, я чувствую себя не так одиноко»), желание внести вклад в общее дело («мне кажется, важно помогать другим»), мотивации карьеры («я могу получить новые контакты, которые могут помочь в моём бизнесе или карьере»), социальной, познавательной («написание „Википедии“ позволяет мне взглянуть на вещи по-новому»), желание быть кому-то нужным («когда я правлю „Википедию“, я чувствую себя востребованным»), потребность в положительных эмоциях («писать/править „Википедию“ — это весело»), идеологической[56].",Russian
"На 30 июня 2015 года существует 290 языковых разделов Википедии, из них 51 раздел содержит более 100 000 статей, а 237 — более 1000 статей[57].",Russian
Посещаемость разделов изменяется со временем.,Russian
К октябрю 2009 года русская Википедия вышла на 5-ю позицию в списке посещаемости.,Russian
По состоянию на август 2013 года русская Википедия находилась на 4-м месте.,Russian
"Первые 5 разделов в это время имели следующий процент посещений, от общего числа: английская — 60,7 %; испанская — 7,8 %; немецкая — 6,7 %; русская — 6,0 %; японская — 5,8 %[58].",Russian
"Википедия является сетевой энциклопедией, поэтому участники одного и того же языкового раздела могут использовать различные диалекты и могут быть из разных стран (как в случае с английским разделом).",Russian
Эти различия могут привести к некоторым конфликтам из-за различного написания слов (например color vs. colour)[59] или точек зрения[60].,Russian
"Несмотря на то, что различные языковые разделы придерживаются глобальной политики, такой как нейтральная точка зрения, они расходятся по некоторым вопросам политики и практики, особенно по вопросу, могут ли изображения, которые не лицензируются по свободной лицензии, использоваться согласно требованиям добросовестного использования[61][62][63].",Russian
Джимми Уэйлс описал Википедию как «усилия по созданию и распространению свободной энциклопедии самого высокого качества для каждого человека на планете на его собственном языке»[64].,Russian
"Несмотря на то, что функционирование каждого языкового раздела более или менее самостоятельно, предприняты некоторые усилия для контроля всех разделов.",Russian
"Они координируются частично Мета-вики, вики Фонда Викимедиа, посвящённой поддержанию всех его проектов (Википедия и др.).",Russian
"Например, Мета-вики предоставляет важную статистику всех языковых разделов Википедии и поддерживает список статей, которые должны быть во всех Википедиях.",Russian
"Список касается основного содержания таких предметов, как биография, история, география, общество, культура, наука, технология, продовольствие и математика.",Russian
"Что касается остального, то нередко для статей, тесно связанных с конкретным языком, нет копии в другом разделе.",Russian
"Например, статьи о малых городах США могут быть доступны только на английском.",Russian
"Переводные статьи представляют лишь небольшую долю статей в большинстве разделов, в частности потому, что автоматизированный перевод статей не разрешён[65].",Russian
"Статьи, доступные более чем на одном языке, могут иметь «интервики»-ссылки, которые связывают статьи с их копиями в других разделах.",Russian
Википедия не лишена недостатков.,Russian
"Прежде всего информация, тексты Википедии объективно подвержены системным отклонениям.",Russian
"Другими основными объектами критики Википедии являются: Критики Википедии указывают на то, что участники Википедии совместно пишут и пересматривают её правила, политики и руководства[67], а затем, зачастую чисто формально и очень негибко их придерживаясь, удаляют, аннотируя тегами комментариев, или изменяют материалы статей, формально не отвечающие этим правилам, политикам и руководствам (см.",Russian
также Википедия:Удализм и Википедия:Инклюзионизм[68][69]).,Russian
"Сообщество Википедии было также описано как «подобное культу»[70], хотя и не всегда с исключительно негативной коннотацией[71] и было раскритиковано за неспособность привлечь неопытных пользователей к работе в проекте[72].",Russian
"Также критики Википедии обращают внимание на системную предвзятость, несбалансированность в освещении тем[52], а также критикуют её политику предпочтения консенсуса между участниками профессионализму отдельных участников в редакционном процессе[73].",Russian
Открытый характер модели редактирования является центральным для большой части критики Википедии.,Russian
"Например, исходя из этого, можно упрекать Википедию в том, что читатель статьи не может быть уверен без ознакомления со страницей её «истории», была ли эта статья вандализирована.",Russian
"Критики утверждают, что редактирование статей неэкспертами подрывает качество представленного в статье материала.",Russian
"Поскольку участники обычно, как правило, переписывают или редактируют отдельные небольшие части статьи, а не всю её целиком, высоко- и низкокачественные материалы могут идти вперемешку в пределах одной статьи.",Russian
"Историк Рой Розенцвейг отметил: «В целом, написание является „ахиллесовой пятой“ Википедии.",Russian
"Комитеты редко пишут хорошо, и статьи Википедии часто имеют изменчивое качество, что является результатом связывания вместе предложений или абзацев, написанных разными людьми»[74].",Russian
Всё это привело к вопросу о надёжности Википедии в качестве источника достоверной информации.,Russian
"Модель Википедии позволяет редактировать её статьи всем желающим и полагается на большую группу благонамеренных редакторов в преодолении проблем, вызванных сомнительными редакторами.",Russian
"Она основана и на принципе, согласно которому подавляющее большинство участников Википедии предполагает добрые намерения.",Russian
Модели редактирования Википедии свойственна возможность добавления низкокачественной информации.,Russian
"Возможность анонимного редактирования может быть не только большим благом для проекта, но и источником некоторого вреда.",Russian
Википедия может подвергаться воздействию вандалов.,Russian
"Вандализм в Википедии — явно вредительское добавление, удаление или изменение содержания, совершённое умышленно в целях скомпрометировать достоверность и авторитетность энциклопедии.",Russian
"В основном вандализм проявляется в замене содержимого статей Википедии на ругательства, граффити, заведомо ложные данные или другое содержимое, абсолютно не имеющее отношения к теме статьи.",Russian
В случаях множественного вандализма к некоторым страницам Википедии может быть применена защита.,Russian
"Являясь общедоступным интернет-справочником, Википедия также содержит материалы, которые другие участники Википедии могут признать нежелательными, оскорбительными или порнографическими[75][76].",Russian
"Например, в 2008 году Википедия отклонила массовое онлайн-обращение против включения изображения Мухаммеда в её английский раздел, сославшись на свою редакционную политику.",Russian
"Наличие в Википедии материалов, «неудобных» с политической точки зрения, также побудило КНР заблокировать доступ к части Википедии для китайских пользователей[77] (см.",Russian
также Блокирование Википедии британской организацией Internet Watch Foundation).,Russian
"Один из основателей Википедии Ларри Сэнгер, который является и одним из её самых жёстких критиков, в 2015 году заявил, что для него Википедия стала разочарованием, поскольку она была захвачена троллями и участниками, чей антиэлитаризм поставил крест на достоверности статей.",Russian
"По словам Сэнгера, Википедия напоминает «психбольницу, управление которой осуществляют сумасшедшие»[31].",Russian
В 2017 году директор некоммерческого партнёрства «Викимедиа.ру» Владимир Медейко объявил о готовности русскоязычной версии «Википедии» к сотрудничеству с обществом «Знание» в деле верификации статей.,Russian
"По его словам, возможны два варианта подобного взаимодействия: использование экспертами «Знания» функции «сообщить об ошибке» с последующим написанием там своих комментариев, которые будут проверены участниками «Википедии», либо создание специального проекта по взаимодействию «Википедии» и «Знания»[78].",Russian
"Техническое функционирование Википедии обеспечивает «Фонд Викимедиа» — некоммерческая организация, которая также поддерживает работу ряда других вики-проектов и осуществляет их финансирование.",Russian
"Фонд также владеет торговой маркой «Wikipedia», но в содержание энциклопедии и в деятельность добровольцев практически никак не вмешивается.",Russian
"Фонд, поддерживаемые им проекты и глобальное сообщество добровольных редакторов образуют Движение Викимедиа.",Russian
В разных странах созданы региональные организации (т. н.,Russian
"«Отделения Викимедиа») и местные ассоциации википедистов, которые также участвуют в продвижении, развитии и финансировании проекта.",Russian
"Функционирование Википедии зависит от MediaWiki — программного механизма для веб-сайтов, работающих по технологии «вики».",Russian
"MediaWiki написан на PHP и для хранения данных использует реляционную базу данных (можно использовать MySQL, PostgreSQL, SQLite) и поддерживает использование программ memcached и Squid[79].",Russian
"MediaWiki предоставляет интерфейс для работы с базой страниц, разграничение прав доступа к администрированию системы, возможность обработки текста как в собственном формате, так и в форматах HTML и TeX (для формул), возможность загрузки изображений и других файлов, а также другие возможности.",Russian
Гибкая система расширений позволяет пользователям добавлять собственные новые возможности и программные интерфейсы.,Russian
"MediaWiki лицензирован под GNU General Public License и используется всеми проектами Викимедиа, а также многими другими вики-проектами.",Russian
"Первоначально Википедия работала на UseModWiki, написанном на Perl Клиффордом Адамсом («Фаза I»), который первоначально требовал CamelCase для указания ссылок на статьи; используемый сейчас стиль двойных скобок был включён позже.",Russian
С января 2002 года («Фаза II») Википедия начала работать на PHP-викидвижке с базой данных MySQL; это ПО было сделано на заказ для Википедии Магнусом Манске.,Russian
ПО «Фазы II» было неоднократно модифицировано с учётом экспоненциально растущего спроса.,Russian
"В июле 2002 года («Фаза III») Википедия перешла на третье поколение программного обеспечения, движок MediaWiki, первоначально написанный Даниэлем Ли Крокером.",Russian
"Википедия в настоящее время работает на выделенных кластерах серверов Linux (в основном Ubuntu[80][81]), с несколькими машинами OpenSolaris для ZFS.",Russian
"Вики-проекты Фонда Викимедиа, самым крупным из которых является Википедия, по состоянию на март 2013 года поддерживались работой нескольких кластеров, состоящих из 974 серверов[82].",Russian
"Википедия работала на одном сервере до 2004 года, когда настройка сервера была расширена в распределённую многоуровневую архитектуру.",Russian
