Text,Language
"сегодня я мог бы употребить энергетический напиток, другие слова, которые вы можете использовать вместо вялости, могут быть вялыми или волочить ноги, так что это были 10 умных слов и раньше.",Russian
"Я даю вам этот секретный совет, чтобы звучать очень бегло.",Russian
"Я хочу напомнить вам, что в случае, если вы ищете умные слова для телефонного звонка, я помещаю ссылку на видео.",Russian
"вниз в поле описания для этого, и теперь секретный совет, секретный совет, чтобы звучать свободно, - это использовать не более одного умного слова или предложения, которое я иногда знаю.",Russian
"мы очень взволнованы, потому что.",Russian
"мы' мы выучили много этих умных слов, и мы склонны вставлять два, три, четыре из них в одно предложение, которое звучит неестественно.",Russian
"так что по очереди убедитесь, что вы правильно произносите слово.",Russian
"Зайдите в Google и введите слово, и в поиске справа вверху вы увидите маленький значок динамика, щелкнувший по этому динамику.",Russian
и прослушайте произношение один или два раза.,Russian
"и вы готовы к работе, и если вам понравилось это видео, не забудьте оставить нам большой палец вверх с комментарием.",Russian
"для меня под ним, говоря мне, какое из этих 10 слов ваше любимое, а также.",Russian
"Если вы еще не нажали кнопку подписки и значок колокольчика рядом с ней, и желаем вам приятного просмотра.",Russian
"Привет, ребята, добро пожаловать на мой канал в этом видео.",Russian
"Я дам вам 50 лучших английских фраз, которые можно использовать в повседневной жизни.",Russian
"так что, если вы только собираетесь отправиться в путешествие.",Russian
в англоязычную страну вы можете полностью использовать это.,Russian
"фразы, если вы изучали английский язык какое-то время и хотите продолжить обучение.",Russian
"это лучшее видео для начала, так что давайте рассмотрим 50 фраз на английском за 10 минут.",Russian
фраза номер один - это еще один способ спросить.,Russian
как дела?,Russian
Как дела?,Russian
как это работает?.,Russian
"Итак, вы встречаетесь с кем-то и у вас время, как дела ?.",Russian
"фраза номер два, когда вы не видели кого-то какое-то время, вы говорите ему, что давно не виделись, это означает, что вы не видели этого человека, может быть, недели или месяцы долгое время не видели номер фразы.",Russian
"три, если вы хотите спросить, чем вы занимались.",Russian
"вы спрашиваете, чем вы занимались и что происходило в вашей жизни?",Russian
"чем ты занимался, чтобы поднять их раньше, если все идет?",Russian
"ну вы можете просто ответить, не могу жаловаться, все действительно круто.",Russian
"не могу пожаловаться на следующую фразу, кто-то вам что-то говорит, а вы на самом деле не упомянули об этом в разговоре, как будто они каким-то образом догадаются, что у вас новая работа, и вы спрашиваете его.",Russian
откуда вы знаете?.,Russian
"Откуда ты такие новости, как поживаешь.",Russian
"знай, если кто-нибудь расскажет классную шутку, ты поймешь, что это хорошая шутка.",Russian
"это отличная шутка, так что фраза хорошая.",Russian
"Если вы хотите кого-то поблагодарить, вы можете сказать, что это очень мило с вашей стороны, большое вам спасибо за это.",Russian
"Это очень мило с вашей стороны, это очень мило с вашей стороны, если кто-то другой.",Russian
"пытался вам помочь, но не смог достичь результата, о котором можно сказать.",Russian
"в любом случае спасибо, это не имеет значения, но все равно спасибо.",Russian
благодарю вас за ваше усилие.,Russian
"в любом случае спасибо, и еще одна фраза, которую я иногда использую в своем электронном письме, когда я не спрашивал человека.",Russian
"я спрашиваю, а потом говорю в конце.",Russian
"заранее спасибо, а это значит, что я очень надеюсь, что вы собираетесь.",Russian
поблагодарить вас заранее.,Russian
"заранее спасибо, если кто-то допустил ошибку, и он очень расстроен из-за этого.",Russian
вы можете просто сказать «не беспокойтесь».,Russian
"не волнуйтесь, не беспокойтесь, а это значит, не беспокойтесь об этом.",Russian
все хорошо.,Russian
"не беспокойтесь, представьте, что вы пришли домой, а все ваши друзья сидят на вашем диване.",Russian
"и тебе нравится, что здесь происходит, например, что ты здесь делаешь?",Russian
"что происходит, если вы что-то не поймали или он не понял человека, которого вы всегда можете спросить, правильно ли я вас понял ?.",Russian
"а затем продолжайте и объясните, где вы попали, я правильно понял ?.",Russian
"Если вы попросите кого-то не расстраиваться, чтобы не плакать, вы можете сказать, не принимайте это близко к сердцу.",Russian
"не принимайте это близко к сердцу, как серьезно, не расстраивайтесь, не принимайте это близко к сердцу.",Russian
"еще один способ спросить, не уловил ли вы часть фразы, которую можно сказать: «Я не уловил последнее слово».",Russian
Мне жаль.,Russian
"Вы можете повторить это, потому что я не расслышал последнее слово, если он хочет, чтобы кто-то снова повторил всю фразу.",Russian
вы можете извиниться.,Russian
"я не слушал, потому что, возможно, ты был занят.",Russian
"может быть, вы разговаривали по телефону, и кто-то говорил с вами, и вам нравится.",Russian
Боже ты мой.,Russian
"извините, я не слушал.",Russian
повторите?.,Russian
Мне жаль.,Russian
"я не слушал другую фразу, которую использую все время.",Russian
"это не имеет значения, как не волнуйтесь, если вы уроните свой кофе на меня.",Russian
как будто это не имеет значения.,Russian
все будет хорошо.,Russian
я' м все равно иду в прачечную.,Russian
"неважно, хотите ли вы кому-нибудь пожелать удачи.",Russian
"и я всегда так делаю, вы можете сказать, скрестив пальцы, и вы скрестите пальцы вот так.",Russian
скрещенные пальцы.,Russian
"еще одна фраза, которую используют американцы, очень плохо объясняет это и. ситуация такова, что вы чего-то не получили, а затем вы получаете дополнительный эффект, и вы его получаете.",Russian
"и ты как ох, это объясняет это объясняет это.",Russian
"еще один способ сказать человеку, чтобы он не расстраивался, - это сказать, что все происходит так, будто все в порядке.",Russian
"вещи случаются, не расстраивайтесь, если у вас нет имени человека, с которым вы хотите поговорить.",Russian
"вы можете извиниться за беспокойство, вы знаете, что видите.",Russian
"кто-то занят, вы всегда можете извиниться за беспокойство, а затем спросить.",Russian
"извините, что беспокою вас.",Russian
"если вы что-то в ком-то Я спрашиваю вас о чем-то, что вы можете сказать.",Russian
"О, вы в процессе чего-то, и кто-то просит вас сделать то, о чем вы говорите, извините.",Russian
"Я буду с вами через минуту, я буду с вами, а затем вы продолжите что-то делать и скажете, где мы были.",Russian
"Например, когда мы остановились, где были, и вы должны повторить это, потому что за звук некоторые люди ошибаются.",Russian
"так что это отличный способ попрактиковаться в том, где мы снова были, если вы в процессе разговора?",Russian
"и вы не поняли того, что говорил другой человек, вы можете сказать, что вы говорили, и с вопросительным знаком.",Russian
"что означает, что побуждает человека повторить еще раз?",Russian
ты говорил .,Russian
"если кто-то получил работу своей мечты, что бы вы ни сказали, повезло вам или кто-то попал в университет их мечты, например, вам повезло, это способ поздравить человека, который вам повезло, или просто подчеркнуть, что ему повезло, повезло вам другой способ сказать что ты действительно зол - значит сказать, что я испугался, как будто я был так зол.",Russian
"о, это почти безумие.",Russian
"Меня напугала другая фраза, которую носители языка используют для вас, и она может быть как положительной, так и отрицательной, когда вы говорите, что меня повысили, и если они говорят, что вам хорошо, например, поздравления, а иногда, если вы говорите, будто я ухожу отсюда.",Russian
"они вроде бы хороши для вас, было бы лучше без вас, и это отрицательное значение, поэтому внимательно слушайте интонацию.",Russian
"если что-то вас удивит, вы также можете сказать, что вы шутите надо мной, как о боже.",Russian
"Я не могу поверить, что ты, должно быть, шутишь, когда говоришь кому-то улыбнуться, и чтобы быть счастливым, ты всегда можешь сказать, подбодритесь, подбодритесь.",Russian
"если вы хотите, чтобы кто-то просто плакал и жаловался на что-то, чего не происходит, вы можете сказать, приходите, я, вы можете сделать это?",Russian
подойди.,Russian
вы можете сделать это вы можете передать toefl вы можете передать gmat вы получите его давай.,Russian
"вы можете сделать это, если у кого-то все хорошо, вы можете сказать им, продолжайте в том же духе, продолжайте в том же духе, например, будьте такими же хорошими, как вы, и продолжайте в том же духе, продолжайте быть еще одна фраза разговорная, и это то, что американцы сказать.",Russian
"это горит, что означает, что это удивительно, как говорили многие американцы в Калифорнии.",Russian
"о, это горит, и вы, наверное, слышали это в песнях, которые ' горит, если кто-то добивается успеха после неудач, так что вы можете сказать, что вы идете, я сказал вам, что вы добьетесь этого не могу сказать немного нах.",Russian
"я хочу продолжить, я не устаю, не от этого, когда кто-то спрашивает тебя: ты уверен, и ты почти уверен, что можешь сказать, что для этого нет места?",Russian
"в Америке нет места для сомнений, если вы хотите отправить кому-нибудь sms или отправить сообщение, которое вы говорите, текст в текст, поэтому я отправлю вам сообщение, значит, я отправлю вам сообщение через WhatsApp, телеграмму или мессенджер, что бы я ни использовал текст вам еще раз, чтобы подбодрить кого-то, чтобы он не расстраивался, вы можете сказать, что это того не стоит, например, почему вы плачете?",Russian
оно того не стоит.,Russian
"ты намного лучше, чем проблема, о которой ты плачешь » не стоит твоих слез.",Russian
это того не стоит.,Russian
"Мне лично нравится фраза, которую ты качаешь, что означает, что ты потрясающий.",Russian
Боже ты мой.,Russian
ты качаешься рок?,Russian
"нет, ты проделал потрясающую работу.",Russian
"вы качаетесь, если кто-то работает не очень хорошо, и вы хотите, чтобы он работал усерднее, вы можете сказать, что вам нужно пройти лишнюю милю, что означает, что, как и в случае усердной работы, вы должны пройти лишнюю милю.",Russian
"другой способ сказать то же самое, что вы можете сказать: «Активизируйте свою игру», например, работайте усерднее, работайте лучше, улучшайте свою игру.",Russian
если кто-то плачет и не хочет этого.,Russian
"это тонет, ты говоришь, возьми себя в руки, как будто буквально возьми себя в руки и возьми себя в руки перестань работать, перестань плакать, соберись.",Russian
эй успокойся вместе еще одна фраза что.,Russian
"Мне нравится, что ты продал меня, потому что иногда люди описывают свою поездку или кого-то, кого они купили, и они описывают это так хорошо.",Russian
"и они такие, как будто я хочу купить то же самое, и я говорю им, что вы продали это вы продали мне, я бы не стал покупать это хорошо, вы продали меня, если вы не заинтересованы в разговоре.",Russian
"ты как сидишь, можешь сказать, что мне все равно, это так скучно.",Russian
Мне это не интересно.,Russian
"мне наплевать, если кто-то вас о чем-то спрашивает, и это действительно простое решение для вас, как будто кто-то говорит, что вы забираете мой 1 миллион долларов, а вы говорите, что это не проблема.",Russian
Я возьму это.,Russian
"Это простая задача означает, что это действительно простое решение для вас, если вы сделали что-то не так и признаете это, вы можете сказать, что я облажался, да, ребята.",Russian
Я знаю.,Russian
Мне жаль.,Russian
Я облажался.,Russian
это моя ошибка.,Russian
"я облажался, я облажался, если ты хочешь, чтобы кто-то работал вместо меня, ты можешь сказать.",Russian
"Ты можешь прикрыть меня, как ты можешь работать вместо меня, пока я?",Russian
я встречаюсь с моим другом.,Russian
"Можете ли вы меня прикрыть, пора уходить, ребята, мне лучше идти, а это значит, что мне уже пора.",Russian
это вы знаете.,Russian
на самом деле сейчас 1 9 вечера.,Russian
прямо сейчас.,Russian
Я лучше пойду другим способом попрощаться.,Russian
"я могу сказать береги себя, что означает заботиться о себе.",Russian
я увижу тебя позже.,Russian
Береги себя.,Russian
"Я не знаю, какой сегодня день, когда вы смотрите это видео, но если это пятница, например, выходные.",Russian
"вы можете сказать «спасибо небесам», это пятница, или подумать, что небеса сказали «открытие субботних выходных».",Russian
"Я так счастлив, что получилось, ребята, 50 фраз на английском, дайте мне знать, было ли это полезным, поставив лайк на это видео и комментируя ниже, если вы знаете еще какие-то интересные фразы.",Russian
"было бы здорово, там где-то есть красная кнопка.",Russian
Привет и добро пожаловать.,Russian
"в этом видео я дам вам 100 общих и очень полезных предложений, которые вы можете использовать в разговоре.",Russian
"когда вы слышите, как предложение повторяется после меня.",Russian
"попробуйте скопировать мое произношение в точности, включая тон голоса, который я использую.",Russian
"хорошо, начнем.",Russian
основные привет как дела?,Russian
как дела?,Russian
что происходит?,Russian
Приятно с Вами познакомиться.,Russian
давно не виделись.,Russian
как твои дела?,Russian
большое спасибо.,Russian
Как насчет тебя?,Russian
немного.,Russian
обычный.,Russian
я должен идти.,Russian
было приятно встретить вас позже.,Russian
оставайтесь на связи.,Russian
запрашивая информацию.,Russian
"не могли бы вы сказать мне, что означает это слово?",Russian
"вы случайно не знаете, где находится библиотека?",Russian
колеблясь.,Russian
Это хороший вопрос.,Russian
дайте-ка подумать.,Russian
позвольте мне немного подумать.,Russian
просят повторения.,Russian
прошу прощения?,Russian
"извините, я не уловил этого.",Russian
не могли бы вы повторить это?,Russian
"ты можешь говорить немного помедленнее, Пожалуйста?",Russian
"говоря ""я не знаю"".",Russian
"Боюсь, я понятия не имею.",Russian
"не могу вам помочь, извините.",Russian
бьет меня.,Russian
мнения.,Russian
Что ты об этом думаешь?,Russian
что ты думаешь по этому поводу?,Russian
"я думаю, это хорошая идея.",Russian
"честно говоря, я не думаю, что это сработает.",Russian
"Насколько я понимаю, это лучший ресторан в городе.",Russian
избегая вопроса.,Russian
у меня нет мнения по этому поводу.,Russian
позвольте мне вернуться к вам по этому поводу.,Russian
я не вправе сказать.,Russian
согласия и несогласия.,Russian
я не мог согласиться с этим.,Russian
ты совершенно прав.,Russian
я согласен с вами на 100%.,Russian
В точку.,Russian
"я не уверен, что согласен.",Russian
"Боюсь, я не согласен.",Russian
я думаю вы ошибаетесь.,Russian
вежливо перебил.,Russian
"извините, что прерываю вас.",Russian
могу я остановить тебя на минутку?,Russian
"ты не возражаешь, если я прыгну сюда?",Russian
преуспевать.,Russian
конечно продолжай.,Russian
Позвольте мне закончить.,Russian
подожди немного.,Russian
предложения.,Russian
что скажешь мы ходим в кино?,Russian
как насчет пиццы на ужин сегодня вечером?,Russian
это было бы прекрасно.,Russian
звучит неплохо.,Russian
я не уверен в этом.,Russian
"нет, я так не думаю.",Russian
составление планов.,Russian
что ты делаешь сегодня вечером?,Russian
есть планы на завтра?,Russian
ты свободен в следующую субботу?,Russian
ты хочешь чем-нибудь заняться в эти выходные?,Russian
"конечно, что ты имеешь в виду?",Russian
"Я свободен все выходные, давай займемся чем-нибудь.",Russian
"нет, извини, я уже помешал на некоторых планах.",Russian
Завтра я немного занят.,Russian
