Text,Language
"அதிகமான கட்டுரைகளைக் கொண்ட மொழிப் பதிப்புக்களில், தொகுப்பாளர்கள் கவனிப்புப் பட்டியலைப் பேண விரும்புகின்றனர்.",Tamil
"தொகுப்புக்கள் அதிகரிப்பதன் காரணமாக, ‘அண்மைய மாற்றங்கள்’ பகுதியில், சில தொகுப்புக்கள் இடம்பெற முடியாமல் போவதே இதற்குக் காரணமாகும்.",Tamil
புதிய பக்கக் கண்காணிப்பு செயன்முறையின் மூலம் புதிதாக உருவாக்கப்பட்ட கட்டுரைகளில் நிகழும் வெளிப்படையான தவறுகள் கண்காணிக்கப்படுகின்றன.,Tamil
"[63] அடிக்கடி தாக்குதலுக்குள்ளாகும் கட்டுரைகளுக்கு, அரைப் பாதுகாப்பு வழங்கப்பட்டுக் குறிப்பிட்ட பயனர்கள் மாத்திரமே தொகுக்கும் வகையில் பாதுகாக்கப்படுகின்றன.",Tamil
"[64] குறிப்பிடத்தக்க, சர்ச்சைக்குரிய கட்டுரைகள் பூட்டப்பட்டு நிர்வாகிகள் மட்டுமே மாற்றங்களை மேற்கொள்ளும் வகையில் காக்கப்படுகின்றன.",Tamil
"[65] தானியங்கிகள் எனப்படும் ‘கணினிச் செய்நிரல்கள்’ மூலமாக எளிமையான, மீண்டும் மீண்டும் செய்ய வேண்டிய பணிகள் செய்யப்படுகின்றன.",Tamil
"உதாரணமாக, இவற்றின் மூலம் பொதுவான எழுத்துப்பிழைகளைத் திருத்தல், ஒழுங்கமைவுப் பிரச்சினைகள் அல்லது புவியியல் சார் கட்டுரைகளைத் துவக்கல் போன்றவற்றைக் குறிப்பிடலாம்.",Tamil
"[66][67][68] சில தானியங்கிகள், வேண்டத்தகாத தொகுப்புக்களை மேற்கொள்ளும் பயனர்களை எச்சரிப்பதற்காகவும் பயன்படுத்தப்படுகின்றன.",Tamil
"[69] இதன்மூலம், வேறு இணையத் தளங்களுக்கான இணைப்புக்கள் தடுக்கப்படுவதோடு, சில குறிப்பிட்ட பயனர் கணக்குகள் அல்லது ஐபி முகவரிகளினால் தொகுப்புக்கள் ஏற்படுத்துவதைத் தடுக்கவும் முடியும்.",Tamil
"விக்கிப்பீடியாவிலுள்ள தானியங்கிகள், இயக்கத்துக்கு முன் நிர்வாகிகளினால் அங்கீகரிக்கப்படல் வேண்டும்.",Tamil
"[70] விக்கிப்பீடியாவிலுள்ள கட்டுரைகள், அவற்றின் விருத்தி நிலை அடிப்படையிலும், விடய அடிப்படையிலும் ஒழுங்கமைக்கப்பட்டிருக்கும்.",Tamil
"[71] ஒரு புதியகட்டுரை, பெரும்பாலும் வரைவிலக்கணம் மற்றும் சில இணைப்புக்கள் மாத்திரமே கொண்ட ஒரு குறுங்கட்டுரையாகவே ஆரம்பிக்கப்படும்.",Tamil
"அதேபோல் பெரும்பாலான விடயங்கள் உள்ளடக்கப்பட்ட பெரிய கட்டுரைகள், சிறப்புக் கட்டுரைகள் என வகைப்படுத்தப்படும்.",Tamil
"சில விக்கிப்பீடியாக்களில், ஒவ்வொரு நாளும் தொகுப்பாளர்களால் தேர்ந்தெடுக்கப்பட்ட ""சிறப்புக் கட்டுரை”யொன்று விக்கிப்பீடியாவின் முதற்பக்கத்தில் காட்டப்படும்.",Tamil
"[72][73] ‘சியாகோமோ பொதேரி’ எனும் ஆய்வாளரின் கண்டுபிடிப்பின்படி, சில தொகுப்பாளர்கள், ஊக்கத்துடன் குறிப்பிட்ட ஒரு கட்டுரையைத் தொகுப்பதன் மூலமே, சிறப்புக்கட்டுரைத் தரம் எட்டப்படுகிறது.",Tamil
"[74] 2010-இல் மேற்கொள்ளப்பட்ட ஆய்வொன்று, சிறப்புக்கட்டுரைகளிடையே, அவற்றின் தரங்கள் வேறுபட்டிருப்பதைக் கண்டறிந்ததோடு, கட்டுரைகளின் தரத்தைக் கணிப்பதில் ‘குழுச் செயற்பாடு’, போதிய தாக்கத்தை ஏற்படுத்தவில்லை எனவும் கருத்து வெளியிட்டது.",Tamil
"[75] 2007-இல், அச்சுவழிப் பதிப்பொன்றை உருவாக்கும் நடவடிக்கையின் போது, ஆங்கில விக்கிப்பீடியா, கட்டுரைகளின் தரத்தைக் கணிப்பிடும் அளவுத்திட்டத்துக்கு எதிரான புதிய தரக்கணிப்பீட்டு முறையை அறிமுகப்படுத்தியது.",Tamil
"[76] விக்கிப்பீடியா தொகுப்பாளர்களின் குழுவொன்று, விக்கித்திட்டம் ஒன்றை உருவாக்கி, குறிப்பிட்ட ஒரு துறையில், தமது பங்களிப்புக்களை வழங்குகின்றது.",Tamil
"இத்திட்டத்தின் ‘பேச்சுப் பக்கம்’ மூலம், பல்வேறு கட்டுரைகளிலும் மேற்கொள்ளப்படும் மாற்றங்களை ஒருங்கிணைப்பர்.",Tamil
"விக்கிப்பீடியா, கட்டற்ற “விக்கிமீடீயா” மென்பொருளில் இயங்குகிறது.",Tamil
"இது “பி.எச்.பி.”, “மைசீக்குவல்” ஆகிய ‘இணைய நிரல் மொழிகள்' மூலம் எழுதப்பட்டது.",Tamil
"இவற்றோடு “எச்.டி.எம்.எல்.”, “சி.எசு.எசு.” ஆகியவையும் பக்கங்களை வடிவமைக்கப் பயன்படுத்தப்படுகின்றன.",Tamil
"விக்கிப்பீடியா, ஒரு தனி ‘வழங்கி’யில், 2004 வரை இயங்கி வந்தது.",Tamil
"அதன் பின்னர், “பல்நிலை வழங்கிக் கட்டமைப்பு”க்கு விக்கிப்பீடியா மாற்றப்பட்டது.",Tamil
"தற்போது 100-க்கும் மேற்பட்ட வழங்கிகள், உலகின் நான்கு பகுதிகளில் விக்கிப்பீடியாவை வழங்குகின்றன.",Tamil
"முதன்மைக் கட்டுரை: தமிழ் விக்கிப்பீடியா தமிழ் விக்கிப்பீடியா முயற்சியானது, 2003 ஆம் ஆண்டு ஆரம்பமானது.",Tamil
"தற்போது இதில் 1,34,235 கட்டுரைகள் உள்ளன.",Tamil
"1,85,747 பயனர் கணக்குகள் பதிவு செய்யப்பட்டுள்ளன.",Tamil
"நியூயார்க்கைச் சேர்ந்த ஆசிரியர் ‘மைக்கேல் மாண்டி’ என்பவர், ஆங்கில விக்கியைப் புத்தகமாகத் தொகுத்துள்ளார்.",Tamil
".ஆங்கிலத்தில் அதிக சரளமாக மாற நாம் அனைவரும் விரைவான வழிகளைத் தேடுகிறோம், என்ன நடக்கிறது என்பது எனக்குத் தெரியும், நம் மூளையைச் சுற்றி ஒரு சில சொற்கள் உள்ளன, மேலும் இந்த முழு உரையாடலையும் அற்புதமான அற்புதமான குளிர் அல்லது காவியத்தைப் பயன்படுத்தி உருவாக்க வேண்டும், எனவே நாம் எப்படி உங்கள் அன்றாட வாழ்க்கையில் நீங்கள் பயன்படுத்தக்கூடிய சில புதிய புதிய ஆங்கில சொற்களைக் கற்றுக் கொள்ளுங்கள் மற்றும் உங்கள் சொற்களஞ்சியத்தை நிமிடங்களில் உயர்த்தலாம்.",Tamil
"எனவே இன்று நாம் 10 புதிய ஸ்மார்ட் சொற்களைக் கற்றுக்கொள்ளப் போகிறோம், அவற்றின் அர்த்தங்கள் மூல சொற்கள் மற்றும் எடுத்துக்காட்டு வாக்கியங்கள், எனவே அனைவருக்கும் இது போகலாம், இது நீங்கள் பார்த்துக் கொண்டிருக்கிறீர்கள்.",Tamil
இந்த வீடியோவில் நான் தினசரி பயன்பாட்டிற்காகவும் இந்த வீடியோவின் முடிவிலும் 10 ஸ்மார்ட் சொற்களை உங்களுக்கு தருகிறேன்.,Tamil
உண்மையிலேயே சரளமாக ஸ்மார்ட் சொல் எண்ணை ஒலிக்க நான் உங்களுக்கு ஒரு ஸ்மார்ட் டிப் கொடுக்கப் போகிறேன்.,Tamil
"ஒன்று சதுப்புநிலமானது சதுப்பு நிலத்தில் மூழ்கி அல்லது வெள்ளம் என்று பொருள், ஆனால் சதுப்பு நிலமானது பெரும்பாலும் நான் போன்ற வேலை சூழலில் பயன்படுத்தப்படுகிறது ' நான் வேலையுடன் சதுப்பு நிலத்தில் இருக்கிறேன், எனக்கு அதிக வேலை இருக்கிறது, இந்த வாரம் முழுவதும் நான் வேலையில் சிக்கியிருக்கிறேன், இப்போது சுவாசிக்க எனக்கு நேரமில்லை, இப்போது இந்த வார்த்தையின் மூலத்தைப் பார்ப்போம்.",Tamil
"சதுப்புநிலம் என்பது ஈரநிலத்தின் ஒரு பகுதி மற்றும் யாரோ ஒரு சதுப்பு நிலத்தில் தவறான இடத்தில் நுழைந்தால் அவர்கள் எளிதில் மூழ்கிவிடுவார்கள் மற்றும் சதுப்பு நிலத்தின் வினை வடிவம் மூழ்குவதைக் குறிக்கிறது, எனவே இந்த வார்த்தையை நீங்கள் எவ்வாறு பயன்படுத்தலாம் என்பது இங்கே.",Tamil
"உங்களிடம் நிறைய பணிகள் உள்ளன என்று சொல்லலாம், உங்களுக்கு ஒரு சோதனை வருகிறது, உங்கள் நண்பர்கள் உங்களிடம் வருகிறார்கள், அவர்கள் சொல்கிறார்கள்.",Tamil
"ஏய் ஏன் நீங்கள் எங்களுடன் ஹேங்கவுட் செய்யக்கூடாது என்று நீங்கள் அவர்களிடம் சொல்லலாம், நான் மிகவும் வருந்துகிறேன், ஆனால் நான் வேலையில் சிக்கியிருக்கிறேன் அல்லது சதுப்பு நிலத்தின் இடத்தில் நீங்கள் பயன்படுத்தக்கூடிய வேறு சில சொற்களை நான் சதுப்பு நிலமாகக் கொண்டுள்ளேன்.",Tamil
செய்ய.,Tamil
என் தட்டில் நான் வேலையில் மூழ்கி இருக்கிறேன்.,Tamil
"ஸ்மார்ட் சொல் எண் இரண்டு கேட்ச் -22 என்பது பணிகள் குறித்து நான் மயங்கிவிட்டேன், இப்போது நான் உறுதியாக இருக்கிறேன் ' கேட்ச் -22 க்கு முன்பு இந்த வார்த்தையை நான் கேள்விப்பட்டிருக்கிறேன், அதாவது நீங்கள் மற்றதைச் செய்தாலன்றி ஒரு காரியத்தைச் செய்ய இயலாது, மற்றதைச் செய்ய முடியாது, ஏனெனில் நீங்கள் முதலில் செய்யவில்லை.",Tamil
"நான் உங்களை குழப்பிவிட்டேன், எனவே உங்களுக்கு சில அனுபவங்களைத் தருகிறேன், வேலை அனுபவம் இல்லாமல் உங்களுக்கு வேலை கிடைக்காதபோது ஒரு பிடிப்பு -22 நிலைமை.",Tamil
ஆனால் நீங்கள் ஒரு வேலையைப் பெறும் வரை அனுபவத்தைப் பெற முடியாது -22 ஜோசப் ஹெல்லரால் அவரது புகழ்பெற்ற புத்தகமான கேட்ச் -22 என்ற புத்தகத்தில் அவர் இரண்டாம் உலகப் போரின்போது படையினருக்கு பொருந்தக்கூடிய சில முரண்பாடான விதிகளை விவரிக்கும் போது உருவாக்கப்பட்டது.,Tamil
"கேட்ச் -22 இன் மற்றொரு எடுத்துக்காட்டு உங்களுக்கு வங்கி கடன் தேவை, ஏனெனில் உங்களிடம் போதுமானதாக இல்லை.",Tamil
"பணம் ஆனால் உங்களிடம் போதுமான பணம் இருப்பதாக வங்கிக்கு நிரூபிக்காவிட்டால் அந்த வங்கிக் கடனைப் பெற மாட்டீர்கள், எனவே அடுத்த முறை நீங்கள் ஒரு தந்திரமான சூழ்நிலையில் சிக்கியிருப்பதை நினைவில் கொள்க.",Tamil
கேட்ச் -22 என்ற வார்த்தையைப் பயன்படுத்த.,Tamil
கேட்ச் -22 க்கு பதிலாக நீங்கள் பயன்படுத்தக்கூடிய பிற சொற்கள் முரண்பாடு அல்லது குழப்பமான ஸ்மார்ட் சொல்.,Tamil
மூன்றாம் எண் suave suave suave என்றால் கண்ணியமான குளிர்ச்சியாக இருக்க அதிநவீனமாக இருக்க வேண்டும்.,Tamil
"சுவேவ் என்ற சொல் பலவிதமான தோற்றங்களைக் கொண்டுள்ளது, ஆனால் இந்த வார்த்தையின் ஒரு சுவாரஸ்யமான தோற்றம் இனிமையான அல்லது இனிமையான ருசிக்கும் உதாரணம் என்று பொருள்.",Tamil
"அவர் மிகவும் தயாராக இருக்கிறார், குறிப்பாக பெண்கள் அல்லது பராக் ஒபாமாவுக்கு முன்னால் மிகவும் மென்மையாகவும் மெருகூட்டப்பட்டவராகவும் இருக்கிறார், இப்போது நீங்கள் அடுத்த முறை ஒரு விருந்தில் இருக்கும்போது நினைவில் கொள்ளுங்கள், இந்த நபரை நீங்கள் பார்க்கிறீர்கள்.",Tamil
நல்ல நடத்தை மற்றும் கலாச்சார மற்றும் அதிநவீன.,Tamil
இந்த வார்த்தையைப் பயன்படுத்தி மூலையில் அங்கேயே இருக்கும் அந்த ஆடம்பரமான பையன் யார் என்று சொல்ல மறக்காதீர்கள் உடனடியாக உங்கள் சொற்களஞ்சியத்தை உருவாக்கும்.,Tamil
"மிகவும் மென்மையானது, ஸ்மார்ட் சொல் எண் நான்கு கொடூரமான கொடூரமானது, கொடூரமான சொல் என்பது மிகவும் மோசமான கொடூரமான கொடூரமான பயங்கரமான தாக்குதல் அட்டூழியம் என்று அழைக்கப்படும் ஒரு லத்தீன் வேர் உள்ளது .இது கொடுமை என்ற வார்த்தையின் கொடூரமான அல்லது பயங்கரமான சில எடுத்துக்காட்டுகள் கொடூரமான வார்த்தையின் சில எடுத்துக்காட்டுகள் டெல்லியில் சமீபத்திய கற்பழிப்பு சம்பவங்கள் கொடூரமானவை அல்லது கைதிகள் சிகிச்சை பெறுகிறார்கள்.",Tamil
"சில நேரங்களில் சிறைச்சாலைகளில் கொடூரமான முறையில் சில பொதுவான தவறான செயல்களைப் பற்றி பேச அன்றாட வாழ்க்கையிலும் பயன்படுத்தப்படுகிறது, அதை நீங்கள் பெரிதுபடுத்த விரும்புகிறீர்கள்.",Tamil
உதாரணமாக அவரது அட்டவணை பழக்கவழக்கங்கள் கொடூரமானவை அல்லது அவளுடைய ஆடை உணர்வு மிகவும் கொடூரமானது அல்லது அவரது இலக்கணம் கொடூரமானது.,Tamil
எனவே அடுத்த முறை செய்திகளில் ஒரு கொடூரமான செயலை நீங்கள் கேட்கும்போது நினைவில் கொள்ளுங்கள்.,Tamil
"ஸ்மார்ட் சொல் எண் 5 பிரமாதமானது, பிரமாதமானது, பிரமாதமானது, ஆச்சரியமான ஆச்சரியம் என்று பொருள்.",Tamil
"இப்போது நாம் இங்கே அற்புதமான வார்த்தையை அடிக்கடி பயன்படுத்துகிறோம் ' உதாரணமாக அற்புதமான அற்புதமான இடத்தில் நீங்கள் பயன்படுத்தக்கூடிய மற்றொரு சொல் இன்று எனது சோதனையில் ஒரு மகத்தான மதிப்பெண் பெற்றேன், அதாவது எனக்கு மிக அதிக மதிப்பெண் கிடைத்தது அல்லது.",Tamil
"எனக்கு மிகச்சிறந்த மதிப்பெண் கிடைத்தது, ஸ்டுபண்டஸ் என்ற சொல்லுக்கு கிளாசிக்கல் லத்தீன் வேர்கள் உள்ளன.",Tamil
"திகைத்துப் போவது மிகவும் பிரமாதமான ஒன்றை விவரிக்கப் பயன்படுகிறது, உதாரணமாக அவள் அந்த உடையில் பிரமாதமாக இருக்கிறாள் அல்லது இந்த பால்கனியில் இருந்து என்ன ஒரு அற்புதமான பார்வை அல்லது நான் இந்த பிரமாதமான புத்தகத்தைப் படித்துக்கொண்டிருக்கிறேன், நீங்கள் எப்படிப் போகிறீர்கள் என்று கீழே வைக்க முடியாது சொல்லுங்கள்.",Tamil
"மாணவர்களுக்கான இந்த அருமையான சேனலான உங்கள் நண்பர்கள் மற்றும் பிரமாதத்திற்கு பதிலாக நீங்கள் பயன்படுத்தக்கூடிய வேறு சில சொற்கள் நம்பமுடியாத அருமையானவை அல்லது விதிவிலக்காக நல்லவை, எனவே இந்த வீடியோவில் சீரான ஐந்து சொற்களைத் தொடர்வதற்கு முன்பு இந்த வீடியோவின் கீழ் ஒரு கருத்தை வைக்க நினைவில் கொள்க.",Tamil
