Text,Language
"இந்த பத்து சொற்களில் எது உங்களுக்கு பிடித்த ஸ்மார்ட் சொல் எண் ஆறு என்பது ஒரு பிழைத்திருத்தத்தில் உள்ளது என்பதைச் சொல்வது ஒரு சிக்கலான சூழ்நிலையில் இருக்க வேண்டும் என்பதற்கு உதாரணம் சிறுவன் நான் ஒரு பிழைத்திருத்தத்தில் இருக்கிறேன், ஏனென்றால் இதற்காக நான் இரண்டு வெவ்வேறு நண்பர்களுடன் திட்டங்களைச் செய்துள்ளேன் சாயங்காலம்.",Tamil
"நான் எனது தொலைபேசியை இழந்துவிட்டேன், நான் ஒரு பிழைத்திருத்தத்தில் இருக்கிறேன் அல்லது இன்று காலை எங்கள் பஸ் உடைந்துவிட்டது, நான் ஒரு பிழைத்திருத்தத்தில் இருக்கிறேன், எனது நண்பர் எப்போதுமே ஒரு பிழைத்திருத்தத்தில் இருக்கும்போது உதவிக்காக என்னிடம் திரும்புவார், போகும் போது அவர் மறந்துவிடுவார்.",Tamil
"அடுத்த முறை நீங்கள் பள்ளியிலிருந்து கணித வீட்டுப்பாடம் பெறும்போது, ​​உங்கள் கணித புத்தகத்தை பள்ளியில் விட்டுவிட்டால், நீங்கள் ஒரு உண்மையான தீர்வில் இருப்பதாக உங்கள் நண்பர்களிடம் சொல்லலாம், இப்போது சொல் பிழைத்திருத்தத்திற்கு ஏதாவது செய்ய வேண்டும் என்று நீங்கள் நினைக்கலாம் எதையாவது சரிசெய்தல்.",Tamil
"ஆனால் ஒரு பிழைத்திருத்தத்தில் ஒரு சிக்கலான சூழ்நிலையில் இருப்பதைக் குறிக்கிறீர்கள், ஒரு பிழைத்திருத்தத்திற்குப் பதிலாக நீங்கள் பயன்படுத்தக்கூடிய பிற சொற்கள் நான் ஒரு சூப்பில் இருக்கிறேன் அல்லது நான் ' நான் ஒரு குழப்பத்தில் இருக்கிறேன் அல்லது நான் தொந்தரவு செய்யும் இடத்தில் இருக்கிறேன் அல்லது நான் ஒரு இடத்தில் இருக்கிறேன் ஸ்மார்ட் சொல் எண் 7 என்பது ஃப்ளூமொக்ஸ் ஃப்ளூமொக்ஸ் என்பது ஒருவரை குழப்புவது.",Tamil
"இப்போது என்ன செய்ய வேண்டும் என்பதை அவர்கள் மறந்துவிடுகிறார்கள், அதற்கு பதிலாக நீங்கள் ஏன் ஃப்ளூமாக்ஸைப் பயன்படுத்தக்கூடாது என்பதற்குப் பதிலாக சிறுவன் முழுவதுமாகப் பார்த்தான் .அவள் வகுப்பில் ஒரு கேள்வியைக் கேட்டபோது அல்லது நாய் புளூமாக்ஸாக இருந்தபோது கண்ணாடியில் தனது சொந்த பிரதிபலிப்பில் அல்லது சுற்றுலாப் பயணி வெவ்வேறு பழக்கவழக்கங்களால் புளகாங்கிதம் அடைந்தார்.",Tamil
"அவர் தனது பயணத்தின்போது அல்லது ஒரு நேர்காணலில் நாங்கள் ஏன் உங்களை வேலைக்கு அமர்த்த வேண்டும் என்று கேட்டபோது அவர் முற்றிலும் புழுக்கமாகப் பார்த்தார், எனவே அடுத்த முறை ஒரு தேர்வில் ஏதேனும் கேள்விகளில் நீங்கள் குழப்பமடைந்தால் நீங்கள்.",Tamil
"நான் எப்போதும் இல்லை என்று எப்போதும் சொல்ல முடியும் பரீட்சைக்கு நான் நன்றாகத் தயாரித்தேன், சில கேள்விகளால் நான் புளூமாக்ஸிற்குப் பதிலாக பயன்படுத்தக்கூடிய பிற சொற்கள் குழப்பமான அல்லது குழப்பமான ஸ்மார்ட் சொல் எண் எட்டு என்பது ரெண்டெஸ்வஸ் ரெண்டெஸ்வஸ் ரெண்டெஸ்வஸ்.",Tamil
"சந்திப்பு அல்லது தேதி என்று சொல்வது மிகவும் பிரஞ்சு வழி, எடுத்துக்காட்டாக, சனிக்கிழமையன்று மதிய உணவுக்கு மேல் எனது நண்பர்களுடன் சந்திப்பேன் அல்லது எனது நண்பர்களுடன் மாலில் சந்திக்க திட்டமிட்டுள்ளேன் திரைப்படங்கள் ரெண்டெஸ்வஸ் ஒரு பெயர்ச்சொல்லாக அல்லது வினைச்சொல்லாக பயன்படுத்தப்படலாம் உதாரணத்திற்கு.",Tamil
நான் இன்று மாலை எனது நண்பர்களுடன் ஒரு சந்திப்பு வைத்திருக்கிறேன் அல்லது நாளை எனது நண்பர்களுடன் சந்திக்கப் போகிறேன்.,Tamil
"படையினருக்கான சந்திப்பு இடத்தைக் குறிக்க இராணுவத்தால் முந்தைய சந்திப்பு பயன்படுத்தப்பட்டது, இப்போது ரெண்டெஸ்வஸ் என்ற வார்த்தையைப் பற்றி சற்று உற்சாகமான மற்றும் ரகசியமான ஒன்று இருக்கிறது, எனவே இப்போது நீங்கள் எந்த சந்திப்பிற்கும் சந்திப்பைப் பயன்படுத்தலாம்.",Tamil
"பொதுவாக ஆனால் அது வென்றது ' ஒரு உத்தியோகபூர்வ சந்திப்புக்கு இது மிகவும் பொருத்தமானதாக இருக்க வேண்டும், எனவே உங்களிடம் ஒரு தேதி இருந்தால், நீங்கள் நிச்சயமாக ஒரு ரெண்டெஸ்வஸ் ஸ்மார்ட் சொல் எண் 9 என்பது முழுமையானது, அபத்தமானது, நீங்கள் ஒருவரை ஊமை அல்லது புரியாத ஒருவரை அழைக்க முயற்சிக்கும்போது அதைப் பயன்படுத்துவீர்கள்.",Tamil
"அல்லது மங்கலான அறிவுள்ள நீங்கள் இப்போது வடிவியல் obtuse கோணத்திலும் கடுமையான கோணத்திலும் obtuse என்ற வார்த்தையை கேள்விப்பட்டிருக்கிறீர்கள், எனவே ஒரு obtuse கோணம் 90 டிகிரிக்கு மேல் ஆனால் 180 டிகிரிக்கு குறைவாக இருக்கும்.",Tamil
"ஒரு கூர்மையான கோணம் 90 டிகிரிக்குக் குறைவான இந்த கூர்மையான கோணமாகும், எனவே ஒரு சொல் கூர்மையைக் குறிக்கப் பயன்படுகிறது, எனவே மனரீதியாகக் கூர்மையானது மற்றும் அபத்தமானது அப்பட்டமானதைக் குறிக்கிறது .அதனால் மனதில் சற்று மெதுவாக இருப்பதால் உதாரணம் கொண்ட வாக்கியங்கள் மனிதன் அவர் தனது கடவுச்சொல்லை ஒரு போலி அழைப்பாளருக்கோ அல்லது பரபரப்பான குழந்தைக்கோ கொடுத்தார்.",Tamil
முடியவில்லை.,Tamil
"சோதனையில் ஒரு கேள்விக்கு பதிலளிக்க அல்லது அப்பட்டமான மனிதனுக்கு அடிப்படை வழிமுறைகளைப் புரிந்துகொள்வதில் சிரமமாக இருந்தது, இப்போது அன்றாட வாழ்க்கையில் உங்கள் சூழ்நிலையில் உங்கள் காதலன் அல்லது உங்கள் காதலி உங்களிடம் கோபமாக இருக்கிறார், ஏன் உங்களால் முடியும் என்று உங்களுக்குத் தெரியாது.",Tamil
"அவர்களிடம் சொல்லுங்கள், நான் கடுமையாக இருக்கிறேன், ஆனால் நீங்கள் ஏன் மிகவும் வருத்தப்படுகிறீர்கள் என்று எனக்குத் தெரியவில்லை ஸ்மார்ட் சொல் எண் 10 மந்தமான மந்தமான மந்தமான வழிமுறையாகும், இது மெதுவான வேகத்தில் மெதுவாக செல்ல வேண்டும்.",Tamil
வழக்கத்தை விட சற்று சோர்வாகவும் குறைவாகவும் இருப்பது.,Tamil
"ஆற்றல் எடுத்துக்காட்டில் ஒரு மதிய உணவு மதிய வேளையில் என்னை மிகவும் மந்தமாக்குகிறது, அதாவது மெதுவான நபர் மற்றும் ஸ்லக் என்பது ஒரு நத்தை எடுத்துக்காட்டுகளைப் போல மிக மெதுவாக நகரும் ஒரு விலங்கு.",Tamil
இந்த ஆண்டு பொருளாதாரம் மிகவும் மந்தமாக உள்ளது அல்லது மந்தமான தொடக்கத்திற்குப் பிறகு போட்டி எடுக்கப்பட்டது.,Tamil
"அல்லது இந்த காலாண்டில் வர்த்தகம் மந்தமாகிவிட்டது, நீங்கள் ஒரு நாள் மிகவும் சோர்வாக உணர்ந்தால் அதை உங்கள் அன்றாட வாழ்க்கையில் பயன்படுத்தலாம், ஒரு நாள் உங்கள் அம்மாவிடம் சொல்லலாம் அல்லது நீங்கள் சொல்லலாம்.",Tamil
உங்கள் நண்பர்கள் நான் மிகவும் மந்தமாக உணர்கிறேன்.,Tamil
"இன்று நான் ஒரு ஆற்றல் பானத்துடன் செய்ய முடியும், மந்தமான இடத்தில் நீங்கள் பயன்படுத்தக்கூடிய பிற சொற்கள் சோம்பலாகவோ அல்லது என் கால்களை இழுப்பதாகவோ இருக்கலாம், எனவே அவை 10 ஸ்மார்ட் சொற்கள் மற்றும் அதற்கு முந்தையவை.",Tamil
மிகவும் சரளமாக ஒலிக்க அந்த ரகசிய உதவிக்குறிப்பை நான் உங்களுக்கு தருகிறேன்.,Tamil
"ஒரு தொலைபேசி அழைப்பில் பயன்படுத்த ஸ்மார்ட் சொற்களை நீங்கள் தேடுகிறீர்கள் என்றால், நான் ஒரு வீடியோவுக்கு இணைப்பை வைக்கிறேன்.",Tamil
"அதற்கான விளக்க பெட்டியில் கீழே, இப்போது ரகசிய முனை சரளமாக ஒலிக்க ரகசிய முனை என்பது சில நேரங்களில் எனக்குத் தெரிந்த ஒன்றுக்கு மேற்பட்ட ஸ்மார்ட் சொல் அல்லது வாக்கியத்தைப் பயன்படுத்தக்கூடாது.",Tamil
நாங்கள் மிகவும் உற்சாகமாக இருக்கிறோம்.,Tamil
"நாங்கள் ' இந்த ஸ்மார்ட் சொற்களை நாங்கள் நிறைய கற்றுக்கொண்டோம், அவற்றில் இரண்டு மூன்று நான்கு ஐ ஒரு வாக்கியத்தில் இயல்பாக ஒலிக்கிறோம்.",Tamil
எனவே ஒரு நேரத்தில் நீங்கள் உச்சரிக்கிறீர்கள் என்பதை உறுதிப்படுத்திக் கொள்ளுங்கள்.,Tamil
சரியான முறையில் சொல் google க்குச் சென்று வார்த்தையைத் தட்டச்சு செய்து மேலே தேடலில் நீங்கள் ஒரு சிறிய ஸ்பீக்கர் ஐகானைக் காண்பீர்கள்.,Tamil
ஒருமுறை அல்லது இரண்டு முறை உச்சரிப்பைக் கேட்கவும்.,Tamil
"நீங்கள் செல்லத் தயாராக உள்ளீர்கள், இந்த வீடியோ உங்களுக்கு பிடித்திருந்தால், எங்களுக்கு ஒரு கருத்தைத் தெரிவிக்க மறக்காதீர்கள்.",Tamil
இந்த 10 வார்த்தைகளில் எது உங்களுக்கு பிடித்தது மற்றும் என்னவென்று என்னிடம் கூறுகிறது.,Tamil
"நீங்கள் ஏற்கனவே சந்தா பொத்தானை அழுத்தவும், அதற்கு அடுத்ததாக உள்ள பெல் ஐகானையும் அழுத்திப் பார்த்தால்.",Tamil
ஏய் தோழர்களே இந்த வீடியோவில் எனது சேனலுக்கு வருக.,Tamil
உங்கள் அன்றாட வாழ்க்கையில் நீங்கள் பயன்படுத்தக்கூடிய முதல் 50 ஆங்கில சொற்றொடர்களை நான் உங்களுக்கு வழங்கப்போகிறேன்.,Tamil
எனவே நீங்கள் உங்கள் பயணத்தைத் தொடங்கப் போகிறீர்கள் என்றால்.,Tamil
"ஆங்கிலம் பேசும் நாட்டிற்கு, இதை நீங்கள் முற்றிலும் பயன்படுத்தலாம்.",Tamil
"சொற்றொடர்கள் நீங்கள் சிறிது நேரம் ஆங்கிலம் கற்றுக் கொண்டிருந்தால், நீங்கள் மீண்டும் கற்றலைத் தொடங்க விரும்பினால்.",Tamil
"தொடங்குவதற்கு இது சிறந்த வீடியோ, எனவே ஆங்கிலத்தில் 50 சொற்றொடர்களை 10 நிமிடங்களில் செல்லலாம்.",Tamil
சொற்றொடர் எண் ஒன்று இது கேட்க மற்றொரு வழி.,Tamil
நீங்கள் எப்படி இருக்கிறீர்கள்?,Tamil
அது எப்படி நடக்கிறது?,Tamil
அது எப்படி நடக்கிறது?,Tamil
"எனவே நீங்கள் ஒருவரைச் சந்திக்கிறீர்கள், அது எப்படிப் போகிறது?",Tamil
"சொற்றொடர் எண் இரண்டு நீங்கள் யாரையாவது சிறிது நேரம் பார்க்காதபோது நீங்கள் அவரை நீண்ட நேரம் பார்க்க வேண்டாம் என்று சொல்லுங்கள், இதன் பொருள் நீங்கள் இந்த நபரை வாரங்கள் அல்லது மாதங்கள் நீண்ட காலமாக பார்த்ததில்லை என்று அர்த்தம்.",Tamil
மூன்று நீங்கள் என்ன செய்து கொண்டிருக்கிறீர்கள் என்று கேட்க விரும்பினால்.,Tamil
உங்கள் வாழ்க்கையில் என்ன நடக்கிறது என்று நீங்கள் கேட்கிறீர்களா?,Tamil
எல்லாம் போகிறதென்றால் அவற்றை வளர்ப்பதற்கு முன்பு நீங்கள் என்ன செய்தீர்கள்?,Tamil
எல்லாவற்றையும் நீங்கள் உண்மையிலேயே புகார் செய்ய முடியாது.,Tamil
"அடுத்த சொற்றொடரை யாராவது உங்களுக்குச் சொல்கிறார்கள், நீங்கள் ஒரு புதிய வேலை இருப்பதாக எப்படியாவது யூகிக்கிறீர்கள் என நீங்கள் அதை உரையாடலில் குறிப்பிடவில்லை, நீங்கள் அவரிடம் கேட்கிறீர்கள்.",Tamil
உங்களுக்கு எப்படி தெரியும்?.,Tamil
நீங்கள் எப்படி இருக்கிறீர்கள் போன்ற செய்தி எங்கிருந்து வந்தது.,Tamil
யாராவது ஒரு நல்ல நகைச்சுவையைச் சொன்னால் அது ஒரு நல்ல விஷயம் என்று நீங்கள் கூறலாம்.,Tamil
"இது ஒரு சிறந்த நகைச்சுவை, எனவே சொற்றொடர் இது ஒரு நல்ல விஷயம்.",Tamil
"நீங்கள் ஒருவருக்கு நன்றி சொல்ல விரும்பினால், அது மிகவும் வகையானது என்று நீங்கள் கூறலாம், அதைச் செய்ததற்கு மிக்க நன்றி, அது உங்களுக்கு மிகவும் வகையானது, யாராவது இருந்தால் அது உங்களுக்கு மிகவும் வகையானது.",Tamil
"உங்களுக்கு உதவ முயற்சித்தது, ஆனால் நீங்கள் சொல்லக்கூடிய முடிவை அடைய முடியவில்லை.",Tamil
"நன்றி எப்படியிருந்தாலும் பரவாயில்லை, ஆனால் எப்படியும் நன்றி.",Tamil
உங்கள் முயற்சிக்கு நன்றி.,Tamil
"எப்படியும் நன்றி இல்லை, நான் ஒரு நபரிடம் கேட்காதபோது சில நேரங்களில் எனது மின்னஞ்சலில் நான் பயன்படுத்தும் மற்றொரு சொற்றொடர்.",Tamil
"நான் கேட்கிறேன், பின்னர் நான் சொல்கிறேன்.",Tamil
"முன்கூட்டியே நன்றி, அதாவது நீங்கள் போகிறீர்கள் என்று நான் நம்புகிறேன்.",Tamil
முன்கூட்டியே உங்களுக்கு நன்றி சொல்லுங்கள்.,Tamil
"யாராவது தவறு செய்திருந்தால் முன்கூட்டியே நன்றி, அவர் அதைப் பற்றி மிகவும் வருத்தப்படுகிறார்.",Tamil
நீங்கள் எந்த கவலையும் இல்லை என்று சொல்லலாம்.,Tamil
"எந்த கவலையும் கவலைப்பட வேண்டாம், அதாவது அதைப் பற்றி கவலைப்பட வேண்டாம்.",Tamil
இது நல்லது.,Tamil
"நீங்கள் வீட்டிற்கு வந்தீர்கள் என்று எந்த கவலையும் இல்லை, உங்கள் நண்பர்கள் அனைவரும் உங்கள் படுக்கையில் அமர்ந்திருக்கிறார்கள்.",Tamil
நீங்கள் இங்கே என்ன செய்கிறீர்கள் என்பது போல இங்கே என்ன நடக்கிறது?,Tamil
நீங்கள் எதையாவது பிடிக்கவில்லை என்றால் என்ன நடக்கிறது அல்லது நீங்கள் எப்போதும் கேட்கக்கூடிய நபருக்கு இது புரியவில்லை என்றால் நான் உன்னை சரியாகப் பெற்றேன்?,Tamil
"பின்னர் மேலே சென்று நீங்கள் எங்கிருந்து வந்தீர்கள் என்பதை விளக்குங்கள், நான் உன்னை சரியாகப் பெற்றேன்?",Tamil
"அழாதபடி வருத்தப்பட வேண்டாம் என்று நீங்கள் யாரையாவது கேட்டால், அதை மனதில் கொள்ள வேண்டாம் என்று சொல்லலாம்.",Tamil
"தீவிரமாக கவலைப்படாதீர்கள், அதை இதயத்திற்கு எடுத்துக் கொள்ளாதீர்கள்.",Tamil
