Text,Language
"மன்னிக்கவும், நான் அதைப் பிடிக்கவில்லை.",Tamil
நீங்கள் அதை மீண்டும் செய்ய நினைப்பீர்களா?,Tamil
"இன்னும் கொஞ்சம் மெதுவாக பேச முடியுமா, தயவு செய்து?",Tamil
"""எனக்குத் தெரியாது"" என்று கூறுகிறார்.",Tamil
எனக்கு தெரியாது என்று பயப்படுகிறேன்.,Tamil
"அங்கு உங்களுக்கு உதவ முடியாது, மன்னிக்கவும்.",Tamil
என்னை துடிக்கிறது.,Tamil
கருத்துக்கள்.,Tamil
நீ அதை பற்றி என்ன நினைக்கிறாய்?,Tamil
இது குறித்து உங்கள் கருத்துக்கள் என்ன?,Tamil
அது ஒரு நல்ல யோசனை என்று நான் நினைக்கிறேன்.,Tamil
நான் வேலை செய்வேன் என்று நேர்மையாக நினைக்கவில்லை.,Tamil
"என்னைப் பொருத்தவரை, இது நகரத்தின் சிறந்த உணவகம்.",Tamil
ஒரு கேள்வியைத் தவிர்ப்பது.,Tamil
இந்த விஷயத்தில் எனக்கு ஒரு கருத்து இல்லை.,Tamil
அதை நான் உங்களிடம் திரும்பப் பெறுகிறேன்.,Tamil
நான் சொல்ல சுதந்திரம் இல்லை.,Tamil
ஒப்புக்கொள்வது மற்றும் உடன்படவில்லை.,Tamil
என்னால் மேலும் ஒப்புக்கொள்ள முடியவில்லை.,Tamil
நீங்கள் சொல்வது முற்றிலும் சரி.,Tamil
நான் உங்களுடன் 100% உடன்படுகிறேன்.,Tamil
நீங்கள் தலையில் ஆணியை அடித்தீர்கள்.,Tamil
நான் ஒப்புக்கொள்கிறேன் என்று எனக்குத் தெரியவில்லை.,Tamil
நான் உடன்படவில்லை என்று பயப்படுகிறேன்.,Tamil
நீங்கள் தவறாக நினைக்கிறீர்கள் என்று நினைக்கிறேன்.,Tamil
பணிவுடன் குறுக்கிடுகிறது.,Tamil
உங்களை குறுக்கிட்டதற்கு மன்னிக்கவும்.,Tamil
ஒரு கணம் நான் உன்னை அங்கே நிறுத்த முடியுமா?,Tamil
நான் இங்கே குதித்தால் நீங்கள் கவலைப்படுகிறீர்களா?,Tamil
மேலே செல்லுங்கள்.,Tamil
நிச்சயமாக செல்லுங்கள்.,Tamil
முடிக்கிறேன்.,Tamil
ஒரு கணம் பிடித்துக் கொள்ளுங்கள்.,Tamil
பரிந்துரைகள்.,Tamil
நாங்கள் திரைப்படங்களுக்குச் செல்கிறோம் என்று நீங்கள் என்ன சொல்கிறீர்கள்?,Tamil
இன்றிரவு இரவு உணவிற்கு பீட்சா சாப்பிடுவது எப்படி?,Tamil
அது நன்றாக இருக்கும்.,Tamil
எனக்கு நன்றாக இருக்கிறது.,Tamil
எனக்கு அது பற்றி உறுதியாக தெரியவில்லை.,Tamil
"இல்லை, நான் அப்படி நினைக்கவில்லை.",Tamil
திட்டங்களை உருவாக்குதல்.,Tamil
இன்று இரவு என்ன செய்கிறீர்கள்?,Tamil
நாளைக்கு ஏதேனும் திட்டங்கள் கிடைக்குமா?,Tamil
அடுத்த சனிக்கிழமையன்று நீங்கள் இலவசமா?,Tamil
இந்த வார இறுதியில் ஏதாவது செய்ய விரும்புகிறீர்களா?,Tamil
"நிச்சயமாக, உங்கள் மனதில் என்ன இருக்கிறது?",Tamil
"எல்லா வார இறுதிகளிலும் நான் சுதந்திரமாக இருக்கிறேன், ஏதாவது செய்வோம்.",Tamil
"இல்லை, மன்னிக்கவும், நான் ஏற்கனவே சில திட்டங்களை வெறித்தனமாக வைத்திருக்கிறேன்.",Tamil
நான் நாளை பிஸியாக இருக்கிறேன்.,Tamil
"நான் ஏதாவது செய்ய விரும்புகிறேன், ஆனால் என்னால் முடியாது.",Tamil
அனுமதி.,Tamil
நான் உங்கள் செல்போனைப் பயன்படுத்தினால் நீங்கள் கவலைப்படுகிறீர்களா?,Tamil
நான் நாளை விடுமுறை எடுத்தால் சரியா?,Tamil
"ஆம், தயவுசெய்து உறுதிப்படுத்திக் கொள்ளுங்கள், மேலே செல்லுங்கள்.",Tamil
"இல்லை, இல்லை.",Tamil
"துரதிர்ஷ்டவசமாக, நான் இல்லை என்று சொல்ல வேண்டும்.",Tamil
நான் விரும்பவில்லை.,Tamil
நான் பயப்படுகிறேன்.,Tamil
கோரிக்கைகளை உருவாக்குகிறது.,Tamil
"நீங்கள் எனக்கு உப்பு அனுப்ப முடியுமா, தயவு செய்து?",Tamil
எனக்கு கொஞ்சம் கடன் கொடுக்க நினைப்பீர்களா?,Tamil
இதற்கு யோ எனக்கு உதவ முடியுமா என்று நான் யோசித்துக்கொண்டிருந்தேன்.,Tamil
நிச்சயமாக எந்த பிரச்சனையும் இல்லை.,Tamil
"ஆமாம், நிச்சயமாக.",Tamil
நான் உதவ மகிழ்ச்சியாக இருப்பேன்.,Tamil
"மன்னிக்கவும், என்னால் இப்போது முடியாது.",Tamil
என்னால் முடியாது என்று பயப்படுகிறேன்.,Tamil
சலுகைகள்.,Tamil
நான் உங்களுக்கு ஒரு கிளாஸ் தண்ணீர் எடுக்கலாமா?,Tamil
சில ஐஸ்கிரீம் பற்றி எப்படி?,Tamil
நான் வீட்டிற்கு ஒரு சவாரி கொடுக்க விரும்புகிறீர்களா?,Tamil
ஆமாம் தயவு செய்து.,Tamil
"அது நன்றாக இருக்கும், நன்றி.",Tamil
"நான் நன்றாக இருக்கிறேன், ஆனால் வழங்கியதற்கு நன்றி.",Tamil
"இல்லை, நான் நன்றாக இருக்கிறேன், நன்றி.",Tamil
மக்களுக்கு நன்றி.,Tamil
மிக்க நன்றி.,Tamil
சியர்ஸ் நான் மிகவும் பாராட்டுகிறேன்.,Tamil
உங்களுடைய உதவிக்கு மனமார்ந்த நன்றி.,Tamil
என்னால் போதுமான நன்றி சொல்ல முடியாது.,Tamil
அது ஒன்றும் இல்லை.,Tamil
அதைக் குறிப்பிட வேண்டாம்.,Tamil
எந்த நேரத்திலும்.,Tamil
என் இன்பம்.,Tamil
யாரையாவது காத்திருக்கச் சொல்கிறது.,Tamil
தயவுசெய்து நீங்கள் சிறிது நேரம் பிடிக்க முடியுமா?,Tamil
ஒரு நொடியில் தொங்க விடுங்கள்.,Tamil
ஒரு கணம் என்னுடன் தாருங்கள்.,Tamil
நான் உங்களுடன் சரியாக இருப்பேன்.,Tamil
மன்னிப்பு கேட்கிறது.,Tamil
நான் அதைப் பற்றி மிகவும் வருந்துகிறேன்.,Tamil
எனது மன்னிப்பை ஏற்கவும்.,Tamil
அதைப் பற்றி கவலைப்பட வேண்டாம்.,Tamil
எந்த கவலையும் இல்லை.,Tamil
"சரி, பொதுவான வாக்கியங்கள் மற்றும் சொற்றொடர்களைப் பற்றிய கூடுதல் படிப்பினைகளை நீங்கள் விரும்பினால், கீழேயுள்ள கருத்துகள் பிரிவில் எனக்குத் தெரியப்படுத்துங்கள்.",Tamil
"இந்த வீடியோ உங்களுக்கு பிடித்திருந்தால், இதுபோன்ற பொத்தானை அழுத்துவதன் மூலம் ஒரு கட்டைவிரலைக் கொடுங்கள், மேலும் எனது சமீபத்திய படிப்பினைகளை இங்கே யூடியூபில் பெற சந்தா பொத்தானைக் கிளிக் செய்வதன் மூலம் இந்த சேனலுக்கு குழுசேர நினைவில் கொள்க.",Tamil
மகிழ்ச்சியான கற்றல் மற்றும் விரைவில் மற்றொரு பாடத்தில் உங்களைப் பார்ப்பேன்.,Tamil
ஒரு முறை ஒரு சிறிய கிராமத்தில் தங்க ரொட்டி மரியன் என்ற பெண் வாழ்ந்தார்.,Tamil
"அவரது ஒரே மகள் நர்சிசா மரியன் மிகவும் தாழ்மையானவர் மற்றும் இனிமையான நர்சிசா இருப்பினும் அவர் முற்றிலும் எதிர்மாறாக இருந்தார், அவள் ஒரு வாழ்க்கையைப் போன்ற வார்த்தைகளுக்கு அப்பால் அழகாக இருந்தாள்.",Tamil
பொம்மை மற்றும் மிகவும் வேடிக்கையான பகுதி அவள் தன்னை நேசித்தாள் நர்சிசா நீங்கள் விரும்புவதில்லை.,Tamil
ரொட்டி சுட எனக்கு உதவுங்கள் இல்லை அம்மா மாவு வேலைக்காரிகள் என் பிரகாசமான மற்றும் பிரகாசமான கண்கள்.,Tamil
"நர்சிசா இந்த விதைகளை நடவு செய்ய நீங்கள் எனக்கு உதவுவீர்கள், நான் ஏன் அதை செய்வேன், என் அழகான விரல்களில் அந்த அழுக்கு அனைத்தையும் நான் பெற்றுள்ளேன், அது என் முகத்தில் நன்றாக சென்றால் அது நர்சிசாவின் பிரச்சனை.",Tamil
திருமணத்தில் நாசீசஸின் கையை கேட்க பல வழக்குரைஞர்கள் வந்த எந்த வேலையும் செய்ய தன்னை பெரிதாக நினைத்தாள்.,Tamil
"அவளுடைய அழகு தொலைதூரத்தில் அறியப்பட்டிருந்தாலும், அவள் அனைவரையும் மிகவும் முரட்டுத்தனமாக நிராகரித்தாள், நேற்று நீங்கள் ஏன் அந்த ஆண்களை ஏன் அனுப்பி வைத்தீர்கள், அவர்கள் நன்றாக இருந்தார்கள், நீங்கள் அவர்களில் ஒருவராக இருக்க முடியாது.",Tamil
"இது போன்ற ஒரு சிறிய கண்கள் கிட்டத்தட்ட ஒரு பறவையைப் போலவே இருந்தன, மற்றொன்று ஒரு பெரிய மூக்கைக் கொண்டிருந்தது, நான் அவருக்கு அருகில் இருக்க விரும்பவில்லை.",Tamil
"அவர் தும்மும்போது ஓ மற்றும் கடைசி நிறுத்தம் இல்லை நான் இனிமேல் கேட்க விரும்பவில்லை, அந்த ஆண்கள் மிகவும் நன்றாக இருந்தார்கள் என் அன்பே நீங்கள் அந்த அழகை அறிந்திருக்க வேண்டும்.",Tamil
நான் ஒரு இளவரசன் அல்லது நைட் போன்ற ஒருவருக்கு தகுதியானவன் என்பதை நீங்கள் உணர வேண்டியதெல்லாம் அம்மா அல்லவா?,Tamil
ஓ அன்பே ஒரு இரவு அவள் தூங்கும்போது அம்மா அவளைப் பார்த்துக் கொண்டிருந்தாள்.,Tamil
"என் அன்பான குழந்தை நீங்கள் மிகவும் அழகாகவும் அழகாகவும் இருக்கிறீர்கள், ஆனால் உங்கள் அழகைத் தவிர வேறு எதையும் நீங்கள் கவனிப்பதில்லை.",Tamil
"அந்த நேரத்தில் நர்சிஸஸ் தூக்கத்தில் சிரிக்கத் தொடங்கினாள், மறுநாள் காலையில் நர்சிஸஸ் இருந்தபோது அவள் மிகவும் வேடிக்கையான கனவு காண வேண்டும் என்று அவளுடைய அம்மா மிகவும் ஆச்சரியப்பட்டாள்.",Tamil
"நான் எழுந்தேன் அவள் எல்லோரும் புன்னகைக்கிறாள், இங்கே கிகில்ஸ் நீங்கள் என்ன கனவு கண்டீர்கள் என்று சொல்லுங்கள்.",Tamil
"நேற்று இரவு நன்றாக அம்மா இது ஒரு அற்புதமான கனவு என்று எனக்குத் தெரியும், இந்த இளவரசன் என்னிடம் வந்தான்.",Tamil
"அவர் என்னை திருமணம் செய்து கொள்ள விரும்புவதாகக் கூறினார், அவர் ஒரு தங்க வண்டியில் வந்திருந்தார், அவர் மேலிருந்து கீழாகவும், தங்கமாகவும் அணிந்திருந்தார், என்ன ஒரு வேடிக்கையான கனவு.",Tamil
"என் திருமண உடையில் நான் தங்கமாக இருந்தபோது அதன் சிறந்த பகுதி உங்களுக்குத் தெரியும், நிச்சயமாக எல்லோரும் என்னை மட்டும் பார்த்துக் கொண்டிருந்தார்கள், அந்த கனவைப் பற்றி ஆச்சரியமாக எதுவும் இல்லை.",Tamil
"இது மிகவும் அகங்காரமான கனவு அம்மாவாக இருந்தது, நீங்கள் என்ன சொல்கிறீர்கள் என்று உங்களுக்குத் தெரியாது என்று கனவு எனக்கு உணர்த்தியுள்ளது, தங்கத்தால் செய்யப்பட்ட வீட்டில் ரொட்டியில் நான் இங்கே சாப்பிடும் வகையை விட மிகப் பெரிய உணவு எனக்குத் தேவை என்பதை உணர்த்தியது.",Tamil
"அந்த ஏழை நர்சிஸஸ் தாய் தனது மகளைப் பற்றி எப்படி கவலைப்பட்டார், எப்படி என்று நினைத்துப் பாருங்கள்.",Tamil
"அந்த நாளில் அவள் தன் வாழ்க்கையை வாழ்வாள், இரண்டு நண்பர்கள் நர்சிஸஸ் தாயைப் பார்க்க வந்தார்கள், அவர்கள் மெல்லியாக இருந்தார்கள், அவர்கள் மூவரும் பல ஆண்டுகளாக நண்பர்களாக இருந்தனர், ஆனால் டெர்ரி மற்றும் எல்லி இருவருக்கும் ஒரு ரகசியம் இருந்தது.",Tamil
"மாயாஜால மனிதர்களாக இருந்திருந்தால், டெர்சி மெல்லி பற்றி நாசீஸின் தாய்க்கு எதுவும் தெரியாது ஓ, உங்களைப் பார்ப்பது மிகவும் நல்லது, இது மிக நீண்ட காலமாக உள்ளது ' நீங்கள் எப்படி இருந்தீர்கள், நான் மிகவும் நன்றாக இருந்திருக்கிறேன், என் மகள் நர்சிசா மட்டும் இன்னும் கொஞ்சம் புரிந்துகொண்டிருந்தால் மரியான் மெல்லி மற்றும் டெர்ரியைப் பற்றி நர்சிசாவைப் பற்றி சொன்னாள், அவள் எப்படி கவலைப்படுகிறாள், அவள் சாப்பிட விரும்புகிறாள் தங்கத்தால் செய்யப்பட்ட ரொட்டி அவள் கனவு நனவாகும் பட்சத்தில் நான் அவளை என்ன செய்வது?",Tamil
"அது அருமையாக இருக்கும், நான் யூகித்தாலும் அவள் கற்றுக் கொள்வாள், வேறு ஒன்றைப் பற்றி பேசலாம்.",Tamil
"இப்போது பின்னர் மெல்லி மற்றும் டெர்ரி தங்கள் பழைய நண்பரிடம் விடைபெற்று, அன்றிரவு தாய் மற்றும் மகள் இருவரும் இரகசியமாக ஒருவருக்கொருவர் புன்னகைத்தனர்.",Tamil
"படுக்கை அம்மாவுக்குத் தயாராகிவிட்டேன், என் கனவு நனவாகும் என்று நம்புகிறேன், அடுத்த நாள் நர்சிசாவும் அவளுடைய தாயும் தங்கள் தோட்டத்தில் ஒரு அழகாக இருந்ததால் உங்களுக்குத் தெரியும்.",Tamil
"தங்க வண்டி அவர்கள் வரை சவாரி செய்து வந்தது, அது கற்கள் மற்றும் வைரங்களில் பதிக்கப்பட்டிருந்தது மற்றும் மிகவும் பிரமிக்க வைக்கிறது.",Tamil
"அது ஒரு அழகான மனிதர் அதிலிருந்து வெளியே வந்து நர்சிஸாவைப் பார்த்தபோது, ​​அவர் என் கனவு எவ்வளவு அழகாக இருந்தார் என்று அவள் முற்றிலும் அதிர்ச்சியடைந்தாள்.",Tamil
"திருமணத்திற்கு நாசீசஸ் கையை கேட்க நான் என்ன வணக்கம் வந்தேன், ஆனால் அவளுடைய பெயர் உங்களுக்கு எப்படி தெரியும், நீங்கள் யார்.",Tamil
"உங்கள் மகளின் பெயரும் அழகும் உலகம் முழுவதும் அறியப்பட்ட நல்ல அதிர்ஷ்டத்தின் தேவதையாக நான் இருக்கிறேன், நான் உங்களுக்கு ஒரு பரிசைக் கொண்டு வந்தேன், ஆனால் அவருடன் நீங்கள் செல்ல முடியாது என்று உங்களுக்குத் தெரியாது.",Tamil
"ஓ வேடிக்கையான அவர் பணக்காரர் மற்றும் அழகானவர், நான் உங்கள் திட்டத்தை ஏற்றுக்கொள்கிறேன்.",Tamil
"அதோடு அவள் அவனுடைய வண்டியில் ஏறினாள், அவளுடைய அம்மாவிடம் விடைபெறாமல் அவர்கள் வண்டியில் பயணம் செய்துகொண்டிருந்தபோது தேவதூதருடன் சவாரி செய்தார்கள், திடீரென்று ஒரு மாயாஜால போர்ட்டலுக்குள் நுழைந்தார்கள், அது ஒரு புயல் பகுதி வழியாகப் பயணித்தது.",Tamil
மிகவும் பயமாக இருந்தது என் அன்பே கவலைப்படாதே இவை அனைத்தும் விரைவில் முடிந்துவிடும் என்று அவர் சொன்னது போல் இந்த வண்டி மற்றொரு போர்டல் வழியாக சென்று டிரைவ்வேயை அடைந்தது.,Tamil
