Text,Language
"Як же пійшли посланці Йоанові, почав глаголати до народу про Йоана: Чого виходили ви дивитись у пустиню? На тростину, що вітер колише?",Ukranian
"Або чого ж виходили їй дивитись? На чоловіка, в мягку одежу одягненого? Ось ті, що в одежі пишній та роскоші, панують у царських дворах.",Ukranian
"Або чого виходили ви дивитись: На пророка? Так, глаголю вам, і більш пророка.",Ukranian
"Се той, про кого написано: Ось я досилаю ангела мого перед лицем Твоїм, що приготовить дорогу Твою перед Тобою.",Ukranian
Глаголю бо вам: Більшого між нарожденими від жінок пророка над Йоана Хрестителя нема; найменший же у царстві Божім більший від него.,Ukranian
"І ввесь народ слухаючий, і митники, справдили Бога, хрестившись хрещеннем Йоановим.",Ukranian
"Фарисеї ж та законники раду Божу про них відкинули, не хрестившись від него.",Ukranian
Рече ж Господь: Кому ж оце уподоблю людей роду сього? й кому подобні вони?,Ukranian
"Подобні вони дітям, що сидять на торгу та гукають одно на одного, та й  кажуть: Ми сурмили вам, а ви не скакали; ми голосили вам, а ви не плакали.",Ukranian
"Прийшов бо Йоан Хреститель, що хлїба не їсть, анї вина не пє, і кажете: Диявола мав.",Ukranian
"Прийшов Син чоловічий, що їсть і пє, і кажете: Ось чоловік прожора та пяниця, митникам друг і грішникам.",Ukranian
І справдилась премудрість од дітей своїх усїх.,Ukranian
"Просив же хтось Його з Фарисеїв, щоб їв з ним. І, ввійшовши з господу Фарисееву, сїв за столом.",Ukranian
"І ось жінка у городі, що була грішниця, довідавшись, що сидить за столом у господї Фарисеевій, принісши любастровий збаночок мира,",Ukranian
"і ставши коло ніг Його ззаду, плачучи, почала обмивати ноги Його слїзми, й волоссєм голови своєї обтирати; й цілувала ноги Його, й мастила миром.",Ukranian
"Бачивши ж Фарисей, що запросив Його, казав сам у собі, говорячи: Коли б сей був пророк, знав би, хто й яка се жінка, що приторкуєть ся до Него; бо грішниця вона.",Ukranian
"І озвавшись Ісус, рече до него: Симоне, маю тобі щось сказати. Він же каже: Учителю, скажи.",Ukranian
"Два довжники були в одного вірителя: один завинив пятьсот денариїв, другий же пятьдесять.",Ukranian
"Як же не мали чим оддавати, обом простив він. Хто ж оце з них, скажи, більш його любити ме?",Ukranian
"Озвав ся ж Симон і Каже: Думаю, що той, кому більш простив він. Він же рече йому: Право судив єси.",Ukranian
"І, обернувшись до жінки, рече Симонові: Чи бачиш ти сю жінку? Увійшов я в твою господу, - води на ноги мої не дав єси; ся ж слїзми обмила ноги мої, і волоссєм голови своєї обтерла.",Ukranian
"Цїлування не дав єси менї; ся ж, відколи ввійшов я, не перестала цілувати ноги мої.",Ukranian
Оливою голови моєї не намастив єси; ся ж миром намастила ноги мої.,Ukranian
"Тим тлаголю тобі: Оставляють ся гріхи її многі, бо возлюбила много; кому ж мало оставляєть ся, мало любить.",Ukranian
Рече ж їй: Оставляють ся гріхи твої.,Ukranian
"І почали ті, що вкупі сиділи, казати в собі: Хто сей, що й гріхи відпускає?",Ukranian
Рече ж до жінки: Віра твоя спасла тебе; йди з упокоєм.,Ukranian
"І сталось опісля, проходив Він городи й села, проповідуючи й благовіствуючи царство Боже; а дванайцять з ним,",Ukranian
"і деякі жінки, що були спїлені од духів лихих і недуг: Мария, на прізвище Магдалина, що з неї сїм бісів вийшло,",Ukranian
"і Йоанна, жінка Хузана, Іродового приставника, й Сусанна, й инших багато, що послугували Йому з добра свого.",Ukranian
"Як же зійшлось багато народу та з усяких городів поприходили до Него, промовив приповістю:",Ukranian
"Вийшов сїяч сїяти насїннє своє; і, як він сїяв, инше впало край шляху; й попритоптувано його, й птаство небесне пожерло його.",Ukranian
"А инше впало на камінь; і посходивши, посохло, бо не мало вогкости.",Ukranian
"А инше впало між тернину; й розвившись тернина в ним, поглушила його.",Ukranian
"А инше впало на землю добру, й, зійшовши, дало овощ у сотеро. Се промовивши, покликнув: Хто має уші слухати, нехай слухає.",Ukranian
"Питали ж Його упеники Його, кажучи: Що се за приповість оця?",Ukranian
"Він же рече: Вам дано знати тайни царства Божого, другим же в приповістях, щоб дивлячись не бачили, й слухаючи не розуміли.",Ukranian
"Єсть же ся приповість: Насіннє, се слово Боже.",Ukranian
"Ті, що край шляху, се, що слухають; опісля ж приходить диявол, та й забирав слово з серця їх, щоб віруючи не спасли ся.",Ukranian
"Що ж на каменї, се, що, вислухавши, з радістю приймають слово, та сї кореня не мають; до часу вірують, а під час спокуси відпадають.",Ukranian
"Що ж між тернину впало, се, ті, що вислухавши, відходять, і журбою, та багацтвом, та роскошами життя поглушені, не дають овощу.",Ukranian
"Що ж у добрій землї, се ті, що, вислухавши слово, в серцї щирому й доброму держять, і дають овощ у терпінню.",Ukranian
"Нїхто ж, засьвітивши сьвічку, не покрива її посудиною, або під ліжко її ставить; тільки ж на сьвічнику ставлять, щоб входячі бачили сьвітло.",Ukranian
"Нема бо нічого тайного, що не виявить ся, і нїчого втаєного, що не взнавть ся і на яв не вийде.",Ukranian
"Вважайте оце, як слухаєте: хто бо має, дасть ся тому; а хто не мав і що, здаєть ся, мав, візьметь ся від него.",Ukranian
"Прийшла ж тодї до Него мати й брати Його, та й не могли зійтись із Ним за народом.",Ukranian
"І сповістили Його, кажучи: Мати Твоя та брати Твої стоять надворі: хочуть Тебе бачити.",Ukranian
"Він же, озвавшись, рече до них: Мати моя та брати мої ті, хто слово Боже слухав і чинить його.",Ukranian
"Стало ся ж одного дня, увійшов Він у човен, і ученики Його; й рече до них: Попливемо на той бік озера. І відчалили.",Ukranian
"Як же плилн, заснув Він; і найшла буря вітряна на озеро, й заливало їх, і були вони в опасностї.",Ukranian
"Приступивши ж розбудили Його, кажучи: Наставниче, наставниче, погибаємо! Він же вставши, погрозив вітрові та буянню води; й з'пинились, і настала тишина.",Ukranian
"Рече ж їм: Де ж віра ваша? Вони ж полякані дивувались, кажучи один до одного: Хто ж оце сей, що й вітрам повелівав, і водї, і слухають Його?",Ukranian
"І переплюш в землю Гадаринську, що по тім боцї Галилеї.",Ukranian
"Як же вийшов Він на землю, зустрів Його один чоловік з города, що мав біса з давнього часу, й одежі не вдягав, і в хатї не пробував, тільки по гробах.",Ukranian
"Побачивши ж Ісуса і закричавши, припав до Него, й голосом великим промовив: Що менї і Тобі, Ісусе, Сину Бога Вишнього? благаю Тебе, щоб мене не мучив.",Ukranian
"Повелів бо духові нечистому вийти з чоловіка: почасту бо схоплював його; й заковувано його в заліза та пута, й стережено; й, розбиваючи о-кови, бував гнаний од біса в пустиню.",Ukranian
"Питав же його Ісус, глаголючи: Яке тобі імя? Він же каже: Легион; бо бісів багато ввійшло в него.",Ukranian
"І благали Його, щоб Він не велїв їм ійти в безодню.",Ukranian
"Був же там великий гурт свиней, що пас ся на горі; і благали Його, щоб дозволив їм в них увійти. І дозволив їм.",Ukranian
"Вийшовши ж біси з чоловіка, увійшли в свині; і кинув ся гурт із кручі в озеро, та й потонув.",Ukranian
"Побачивши ж пастухи, що сталось, повтікали, й, пійшовши, сповістили по городах і по селах.",Ukranian
"Повиходили ж дивитись, що сталось, і прийшли до Ісуса, й знайшли сидячого чоловіка, що з него біси вийшли, одягненого й при розумі, в ногах у Ісуса, й злякались.",Ukranian
"Сповістили ж їх і ті, що бачили, як спас ся біснуватий.",Ukranian
"І благав Його ввесь народ околиці Гадаринської вийти від них, бо страх великий обняв їх; Він же, ввійшовши в човен, вернув ся.",Ukranian
"Благав же Його чоловік, з котрого вийшли біси. Щоб бути з Ним; відпустив же його Ісус, глаголючи:",Ukranian
"Вернись до дому твого та розкажи, скільки зробив тобі Господь. І пійшов він по всьому городу, проповідуючи, скільки зробив йому .Ісус.",Ukranian
"Стало ся ж, як вернувсь Ісус, прийняв Його народ: всі бо дожидали Його.",Ukranian
"І ось прийшов чоловік, котрому ймя Яір (а сей був старшиною над школою), і, припавши до ніг Ісусові, благав Його, щоб увійшов у господу його.",Ukranian
"Бо дочка єдина була в него літ дванайцяти, і та вмирала. Як же йшов Він, народ тиснув ся до Него;",Ukranian
"і одна жінка, бувши в кровотічі років дванайцять, котра, на лїкарів витративши ввесь прожиток, не могла нї від кого вигоїтись,",Ukranian
"і, приступивши ззаду, приторкнулась до краю одежі Його, й зараз перестала кровотіч її.",Ukranian
"І рече Ісус: Хто приторкнув ся до мене? Як же всї відпирались, сказав Петр і ті, що з Ним: Наставниче, народ товпить ся та тиснеть ся до Тебе, а Ти кажеш: Хто приторкнувсь до мене?",Ukranian
"Ісус же рече: Приторкнув ся до мене хтось; я бо чув, що сила вийшла з мене.",Ukranian
"Бачивши ж жінка, що не втаїть ся, трясучись приступила й, припавши перед Ним, з якої причини приторкнулась до Него, сповістила Його перед усім народом, і як одужала зараз.",Ukranian
"Він же рече їй: Бодрись, дочко: віра твоя спасла тебе; йди з упокоєм.",Ukranian
"Ще Він промовляв, приходить один від шкільного старшини, кажучи Мому: Вмерла дочка твоя; не труди учителя.",Ukranian
"Ісус же, дочувши, озвав ся до него, глаголючи: Не бій ся; тільки віруй, то й спасеть ся.",Ukranian
"Увійшовши ж у господу, не пустив увійти нїкого, тільки Петра, та Якова, таЙоана, та батька дитини й матір.",Ukranian
"Плакали ж усї й голосили по нїй; Він же рече: Не плачте; не вмерла, а спить.",Ukranian
"І сьміялись вони з Него, знаючи, що вмерла.",Ukranian
"Він же, випровадивши надвір усїх, і взявши за руку її, покликнув, глаголючи: Дївчинко, встань.",Ukranian
"І вернув ся дух її, і встала зараз; і звелїв їй дати їсти.",Ukranian
"І дивувались родителї її; Він же заповів їм нікому не казати, що сталось.",Ukranian
"Скликавши ж дванайцятьох учеників своїх, дав їм силу й власть над усіма бісами, й недуги сцїляти.",Ukranian
І післав їх проповідувати царство Боже та оздоровлювати недужих.,Ukranian
"І рече до них: Нічого не беріть на дорогу, нї палиці, нї торбини, ні хліба, нї срібла, анї по дві одежині майте.",Ukranian
"І в котору господу прийдете, там пробувайте й звідтіля виходьте.",Ukranian
"А хто не прийме вас, виходячи з города того, й порох з ваших ніг обтрусїть на сьвідкуванне проти них.",Ukranian
"Вийшовши ж, ходили по селах; благовіствуючи та сцїляючи всюди.",Ukranian
"Почув то Ірод четверовластник усе, що сталось від Него, та й стуманів: тим що деякі казали, що Йоан устав із мертвих,",Ukranian
"инші ж, що Ілия явив ся, другі ж, що один з пророків старих воскрес.",Ukranian
"І каже Ірод: Йоана я стяв; хто ж се той, про котрого я чую таке? І шукав видїти Його.",Ukranian
"І вернувшись апостоли, оповідали Йому, що чинили. І взявши їх, пійшов окреме у місце пусте города, званого Витсаїда.",Ukranian
"Народ же дознавшись, пійшов слїдом за Ним; і, прийнявши їх, глаголав їм про царство Боже й, кому треба було сцїлення, оздоровлював.",Ukranian
"День же почав нахилятись; приступивши ж дванадцять, сказали Йому: Відошли народ, щоб, пійшовши кругом по селах та хуторах, відпочили й роздобули харчі; бо ми тут у пустому місці.",Ukranian
"Рече ж до них: Дайте ви їм їсти. Вони ж сказали: Нема в нас більш, як пять хлібів та дві риби; хиба що пійшовши купимо для всього народу сього їжі.",Ukranian
Було бо до пяти тисяч чоловіка. Рече ж до учеників своїх: Садовіть їх купами по пятьдесятеро.,Ukranian
"І зробили так, і посадовили всіх.",Ukranian
"Узявши ж пять хлібів та дві риби й поглянувши на небо, благословив їх, і ламав, і давав ученикам класти перед народом.",Ukranian
"І їли, й наситились усї; і назбирано остальних у них окрушин дванайцять кошів.",Ukranian
"І сталось, як Він молив ся на самотї, були з Ним ученики; й спитав їх, глаголючи: Хто я, каже народ?",Ukranian
Вони ж озвавшись сказали: Йоан Хреститель; другі: Ілия; инші ж: Що один пророк із старих воскрес.,Ukranian
"Рече ж їм: Ви ж, хто я, кажете? Озвав ся ж Петр і сказав: Христос Божий.",Ukranian
"Він же, заказавши їм, повелїв нікому не казати про се,",Ukranian
"глаголючи: Що мусить Син чоловічий багато терпіти, й відцурають ся Його старші, та архиєреї, та письменники, і вбють, і в третїй день воскресне Він.",Ukranian
"Рече ж до всїх: Коли хто хоче за мною йти, нехай одречеть ся себе й бере хрест, свій щодня, та й іде слїдом за мною.",Ukranian
"Хто бо хоче душу свою спасти погубить її; хто ж погубить душу свою задля мене, той спасе її.",Ukranian
"Що бо за користь мати ме чоловік, здобувши сьвіт увесь, себе ж погубивши або занапастивши?",Ukranian
"Хто бо посоромить ся мене й моїх словес, того й Син чоловічий посоромить ся, як прийде в славі своїй, і Отця, і сьвятих ангелів.",Ukranian
"Глаголю ж вам істино: Єсть деякі між стоячими тут, що не вкусять смертї, аж поки побачять царство Боже.",Ukranian
"Було ж після словес тих днїв з вісїм, і взявши Петра, та Йоана, та Якова,  зійшов на гору молитись.",Ukranian
"І, як молив ся Він вид лиця Його став инший, і одежа Його біла, блискуча.",Ukranian
"І ось два чоловіки розмовляли з Ним, котрі були Мойсей та Ілия;",Ukranian
"вони, явившись у славі, говорили про смерть Його, яку мав сповнити в Єрусалимі.",Ukranian
"Петр же й ті, що з Ним, були отягчені сном; пробудивши ся ж, побачили славу Його й двох чоловіків, стоячих з Ним.",Ukranian
"І сталось, як розлучались від Него, каже Петр до Ісуса: Наставниче, добре нам тут бути: зробимо три намети, один Тобі, й Мойсею один, а один Ілиї, не знаючи, що каже.",Ukranian
"Як же він се говорив, постала хмара, та й отінила їх, і полякались, як вони увійшли в хмару.",Ukranian
"І роздав ся голос із хмари, говорячи: Се син мій любий; слухайте Його.",Ukranian
"А як був голос, знайдено Ісуса одного. І мовчали вони, й нікому не оповідали в ті дні нїчого, що бачили.",Ukranian
"Стало ся ж другого дня, як зійшли вони з гори, зустріло Його багато народу.",Ukranian
"І ось чоловік з народу покликнув, кажучи: Учителю, благаю Тебе, зглянь ся на сина мого; бо він єдиний у мене.",Ukranian
"І ось дух хапав його, і він зараз кричить; і рве його з піною, і ледві одходить од него, розбивши його.",Ukranian
"І благав я учеників Твоїх, щоб вигнали його, й не здолїли.",Ukranian
"І озвавшись Ісус, рече: О кодло невірне та розвратне! доки буду з вами й терпіти му вас? Приведи сюди сина твого.",Ukranian
"Ще ж ійшов він, а біс ударив ним, та й затряс. Погрозив же Ісус духові нечистому, і оздоровив хлопця, і оддав його батькові його.",Ukranian
"З'умляли ся ж усї величчєм Божим. Як же всі дивувались усїм, що зробив Ісус, рече Він до учеників своїх:",Ukranian
Повкладуйте в уші ваші слова сї: Син бо чоловічий має бути виданим у руки чоловічі.,Ukranian
"Вони ж не зрозуміли слова сього, й було воно закрите від них, щоб не постерегли його; а бояли ся питати Його про слово се.",Ukranian
"Постала ж думка між ними, хто був би більший з них.",Ukranian
"Ісус же, знаючи думку серця їх, узявши дитину, поставив її біля себе,",Ukranian
"і рече їм: Хто прийме сю дитину в імя моє, мене приймав; а хто мене прийме, приймає пославшого мене: хто бо найменший між усїма вами, той буде великий.",Ukranian
"І озвавшись Йоан, каже: Наставниче, ми бачили одного, що в імя Твоє виганяв біси, й заборонили йому; бо не ходить услїд з нами.",Ukranian
"І рече до него Ісус: Не боронїть, хто бо не проти нас, той з нами.",Ukranian
"І сталось, як сповнились днї взяття Його (вгору), утвердив лице своє йти в Єрусалим,",Ukranian
"і післав посланці перед лицем своїм; і пійшовши вони, увійшли в село Самарянське, щоб приготовити Йому.",Ukranian
"І не прийнято Його, бо лице Його було грядуще в Єрусалим.",Ukranian
