Text,Language
"Ви прийняли закон через розпорядки ангелів, та й не хоронили його.",Ukranian
"Почувши ж се, запалали серцем своїм, і скреготали зубами на него.",Ukranian
"Він же, будучи повний сьвятого Духа, споглянувши на небо, побачив славу Божу, й Ісуса, стоячого по правиці у Бога,",Ukranian
"і рече: Ось, виджу небеса відчинені, і Сина чоловічого, стоячого по правицї в Бога.",Ukranian
"Вони ж закричали голосом великим, позатуляли уші свої, та й кинулись однодушне на него,",Ukranian
"і, випровадивши за город, укаменували його; а сьвідки поклади одежу свою у ногах у молодця, званого Савлом,",Ukranian
"і каменували Стефана, молячогось і глаголючого: Господи Ісусе, прийми дух мій.",Ukranian
"Приклонивши ж колїна, покликнув голосом великим: Господи, не постав їм сього за гріх. І, се промовивши, уснув.",Ukranian
"Савло ж похваляв убийство його. Стало ся ж того дня велике гоненнє на церкву Єрусалимську і всї порозсипались по землях Юдейських та Самарийських, окрім апостолів.",Ukranian
"Поховали ж Стефана побожні люде, і счинили великий плач по нему",Ukranian
"Савло ж руйнував церкву, входячи в доми та хапаючи і виволікаючи чоловіків і жінок, і передавав у темницю,",Ukranian
"Которі ж порозсипались, ходили, благовіствуючи слово.",Ukranian
"І так, Филип, прийшовши в город Самарийський, проповідував їм Христа.",Ukranian
"І вважав народ на слова Филипові однодушне, слухавши і бачивши ознаки, що він робив.",Ukranian
"З многих бо, що мали духів нечистих, виходили вони, ревучи великим голосом; і многі розслаблені і криві сцїлялись.",Ukranian
І стались радощі великі в городі тому.,Ukranian
"Один же чоловік, на ймя Симон, пробував перше у городі, і чарував та дивував народ Самарийський, кажучи, що він хтось великий.",Ukranian
"На него вважали всі від малого до старого, кажучи: Сей єсть велика сила Божа.",Ukranian
"Вважали ж на него через те, що доволї часу чарами дивував їх.",Ukranian
"Як же увірували Филипу, що благовіствував про царство Боже й імя Ісуса Христа, то хрестились і чоловіки й жінки.",Ukranian
"Увірував же і сам Симон, і, охрестившись, пробував у Филипа; а, видївши ознаки й чудеса великі, дивував ся.",Ukranian
"Почувши ж апостоли в Єрусалимі, що прийняла Самария слово Боже, послали до них Петра та Йоана,",Ukranian
"котрі прийшовши, молили ся про них, щоб прийняли Духа сьвятого.",Ukranian
"(Ще бо ні на кого з них не зійшов, а тільки охрещені були в імя Господа Ісуса.)",Ukranian
"Тоді клали руки на них, і прийняли вони сьвятого Духа.",Ukranian
"Видівши ж Симон, що положеннєм рук апостолських даєть ся Дух сьвятий, принїс їм грошей,",Ukranian
"говорячи: Дайте й менї власть таку, щоб, на кого я положу руки, прийняв Духа сьвятого.",Ukranian
"Петр же рече до него: Нехай срібло твоє з тобою буде на погибель, бо дар Божий думав єси за гроші здобути.",Ukranian
"Нема для тебе частини, анї долї в речі сїй, серце бо твоє не праве перед Богом.",Ukranian
"Покай ся ж у ледарстві сьому твоїм, та благай Бога: може відпустить ся тобі думка серця твого.",Ukranian
Бо в жовчі гіркости і в увязї неправди виджу тебе.,Ukranian
"Озвав ся ж Симон та й каже: Молїть ся ви за мене Господу, щоб нїщо не найшло на мене, що ви сказали.",Ukranian
"Ті ж, що сьвідвували, глаголавши слово Господнє, вернулись у Єрусалим, і в многих селах Самарийських благовіствували.",Ukranian
"Ангел же Господень промовив Филипові, глаголючи: Устань, та йди на полуднє дорогою, що йде 8 Єрусалиму в Газу; вона пуста.",Ukranian
"І вставши дійшов; і ось чоловік із Єтіопиї, євнух, вельможа Кандакиї, царицї Єтіопської, що був над усїм скарбом її; він приходив поклонитись у Єрусалим;",Ukranian
"і вертав ся, а сидячи на возї своїм, читав пророка Ісаїю.",Ukranian
Рече ж Дух Филипові: Приступи та пристань до воза сього.,Ukranian
"Приступивши ж Филип, почув його, як читав пророка Ісаїю, і рече: Чи розумієш, що читаєш?",Ukranian
"Вія же каже: Як бо можу, коли ніхто не наведе мене? І просив Филипа, щоб, вилізши, сїв в ним.",Ukranian
"Місце ж писання, що читав, було се: Як овечку на зарізь ведено Його; й як ягня перед тим, хто стриже його, безголосе, так не відкривав уст своїх.",Ukranian
У приниженню Його суд Його взято; рід же Його хто з'ясує? бо береть ся з землї життв Його.,Ukranian
"Озвав ся ж євнух, і каже до Филипа: прошу тебе, про кого пророк глаголе се? про себе, чи про иншого кого?",Ukranian
"Відкривши ж Филип уста свої, і почавши від писання сього, благовіствував йому Ісуса.",Ukranian
"Верстаючи ж дорогу, прибули до води; й каже євнух: Ось вода; що боронить менї охреститись?",Ukranian
"Рече ж Филип: Коли віруєш усїм серцем, то можна. Озвавши ся ж, каже: Вірую, що Син Божий Ісус Христос.",Ukranian
"І звелїв з'упинити воза; й увійшли обидва в воду, Филип і євнух; і охрестив його.",Ukranian
"Як же вийшли з води. Дух Господень ухопив Филипа, і не бачив його більш євнух; і пійшов дорогою своєю, радуючись.",Ukranian
"Филип же опинивсь ув Азотї, і проходячи проповідував по всїх городах, аж доки прийшов у Кесарию.",Ukranian
"Савло ж, ще дишучи грозьбою та вбийством на учеників Господніх, ї приступив до архиєрея,",Ukranian
"і просив від него листів у Дамаск до шкіл, щоб, коли кого знайде, що с путя того будуть, чоловіків і жінок, звязавши, поприводив у Єрусалим",Ukranian
"Ідучи ж був близько Дамаску, аж ось осияло його сьвітло з неба,",Ukranian
"і, впавши на землю, чув голова глаголючий йому: Савле, Савле, чого мене гониш?",Ukranian
"Каже ж: Хто єси, Господи? Господь же рече: Я Ісус, котрого ти гониш. Трудно тобі проти рожна прати (упиратись).",Ukranian
"І затрусившись та стуманівши, каже: Господи, що хочеш, щоб робив я? А Господь до него: Устань, та йди в город; і скажеть ся тобі, що маєш робити.",Ukranian
"Люде ж, що йшли з ним, стояли з'умівшись, чуючи голос, нікого ж не бачивши.",Ukranian
"Устав же Савло з землї; як же відтворив очі, нїкого не бачив. І вели його за руку, та й приведи в Дамаск.",Ukranian
"І був він три днї невидющим, і не їв і не пив.",Ukranian
"Був же один ученик у Дамаску, на ймя Ананїя; і рече йому Господь у видїннї: Ананїє! Він же каже: Ось я, Господи.",Ukranian
"Господь же до него: Уставши, йди на улицю, що зветь ся Простою, та й пошукай у Юдиній хатї Тарсянина, на ймя Савла; ось бо він молить ся,",Ukranian
"І видїв (Савло) у видїннї чоловіка, на ймя Ананїю, що (нїби) ввійшов і положив руку на него, щоб прозрів.",Ukranian
"Відказав же Ананїя: Господи, я чув од многих про чоловіка сього, скільки він зла заподіяв сьвятим твоїм у Єрусалимі;",Ukranian
"і тут має власть од архиєреїв вязати всїх, хто призиває імя Твоє.",Ukranian
"Рече ж до него Господь: Іди, бо сей у мене вибрана посудина, щоб нести ймя моє перед поган, і царів і синів Ізраїлевих:",Ukranian
"я бо покажу йому, скільки мусить він за ймя моє терпіти.",Ukranian
"ІІійшовши Ананїя, ввійшов у господу та, положивши на него руки, рече: Савле брате! Господь Ісус, що явивсь тобі в дорозі, котрою йшов єси, післав мене, щоб ти прозрів і сповнив ся Духом сьвятим.",Ukranian
"І зараз із очей йому, мов би луска, спало, і прозрів того часу, та й вставши, охрестив ся.",Ukranian
"І прийнявши їжу, покрепив ся. Був же Савло з учениками, що в Дамаску, днїв кілька.",Ukranian
"І зараз проповідував по школах Христа, що се Син Божий.",Ukranian
"Дивувались же усї, хто чув, і казали: Чи се не той, що погубляв у Єрусалимі призиваючих се імя, та й сюди на те прийшов, щоб, звязавши їх, вести до архиєреїв?",Ukranian
"А Савло вбивавсь у силу та в силу, й перемагав Жидів, що жили в Дамаску, доводячи, що се Христос.",Ukranian
"Як же сповнилось доволї днїв, змовили ся Жиди, вбити його.",Ukranian
"Довідав ся ж Савло про змову їх. А вони стерегли воріт день і ніч, щоб його вбити.",Ukranian
"Взявши ж його ученики в ночі, спустили через мур у коші.",Ukranian
"Прийшовши ж Савло в Єрусалим, пробував пристати в ученики; та всі боялись його, не діймаючи віри, що він ученик.",Ukranian
"Варнава ж, прийнявши його, повів до апостолів, і розповів їм, як він дорогою видїв Господа, і як він глаголав йому, та як у Дамаску одважно проповідував імя Ісусове.",Ukranian
І ввіходив і виходив з ними в Єрусалимі.,Ukranian
І одважно проповідував імя Господа Ісуса й розмовляв і змагав ся з Єленянами; вони ж лагодились убити його.,Ukranian
"Довідавшись же брати, привели його в Кесарию, та й вислали його в Тарс.",Ukranian
"Церкви ж по всій Юдеї і Галилеї і Самариї мали впокій, будуючись і ходячи в страсї Господнім, а потіхою сьвятого Духа намножувались.",Ukranian
"Стало ся ж, як переходив Петр усї, прийшов і до сьвятих, що проживали в Лиддї.",Ukranian
"Знайшов же там одного чоловіка, на ймя Єнея, що на ліжку лежав вісїм років, будучи розслабленим.",Ukranian
"І рече йому Петр: Єнею, оздоровлює тебе Ісус Христос; устань, та й постели собі. І зараз устав.",Ukranian
"І бачили його всі, що жили в Лиддї та в Саронї, котрі навернулись до Господа.",Ukranian
"Була ж в Йоппиї одна учениця, на ймя Тавита, що перекладом зветь ся: Сарна. Ся була повна добрих учинків і милостинї, що робила.",Ukranian
"Стало ся ж, що тими днями занедужавши, вмерла вона. Обмивши ж її, положили в гірницї.",Ukranian
"Як же близько була Лидда від Йоппиї, то ученики, почувши, що Петр там, післали двох чоловіків до него, просячи, щоб не загаявсь прийти до них.",Ukranian
"Устав же Петр, та й пійшов а ними. Як же прийшов, повели його в гірницю; і обступили його всї вдовицї плачучи й показуючи одежу й шматтє, що їм посправляла, бувши з ними Сарна.",Ukranian
"Випровадивши ж Петр усїх і приклонивши колїна, молив ся, і, обернувшнсь до тіла, рече: Тавито, встань, вона ж відкрила очі свої і, побачивши Петра, сіла.",Ukranian
"Подавши їй руку, підвів її, покликавши ж сьвятих та вдовиць, поставив її перед ними живу.",Ukranian
"І знане се стало по всій Йоппиї, і многі увірували в Господа.",Ukranian
"Стало ся ж, що доволї днїв пробував він у Йоппиї у одного Симона кожемяки (гарбаря).",Ukranian
"Був же один чоловік у Кесариї, на ймя Корнелий, сотник із роти, званої Італийською,",Ukranian
"побожний і богобоязливий з усїм домом своїм, подавав він багато милостинї народові, і молив ся всякого часу Богу.",Ukranian
"Видів же він у видінні ясно коло девятої години, як ангел Божий ввійшов до него й промовив йому: Корнелию!",Ukranian
"Він же, глянувши на него, злякав ся, і каже: Чого, Господи? Рече ж йому : Молитви твої і милостинї твої спогадались перед Богом.",Ukranian
"Пішли ж тепер у Йоппию людей та приклич Симона, що прозиваєть ся Петром.",Ukranian
"Він гостює в одного Симона кожемяки, що хата його над морем. Сей скаже тобі, що маєш робити.",Ukranian
"Як же пійшов ангел, що глаголав до Корнелия, покликавши він двох слуг своїх, та побожного воїна з тих, що стерегли його,",Ukranian
"і розказавши їм усе, післав їх у Йоппию.",Ukranian
"Назавтра ж, як буди в дорозї і наближались до города, зійшов Петр на кришу помолитись коло шестої години.",Ukranian
"Став же голодний і забажав їсти; як же готовили, найшло на него захопленнє,",Ukranian
"і видить небо відчинене, і що сходить до него посудина якась, наче обрус великий, по чотиром кінцям звязаний і спускаючий ся на землю,",Ukranian
"в котрому були всякі чотироногі землї, і зьвірі, і повзючі, і птиці небесні.",Ukranian
"І роздав ся голос до него: Устань, Петре, заколи, та й їж.",Ukranian
"Петр же каже: Нї, Господи, ніколи бо не їв я нічого поганого та нечистого.",Ukranian
"А голос знов вдруге до него: Що Бог очистив, ти не погань.",Ukranian
Стало ся ж се тричі; і взято знов посудину на небо.,Ukranian
"Як же сумнївав ся в собі Петр, що се за видїннє було, що видів, аж ось два чоловіки, послані від Корнелия, розпитавши про Симонову господу, стали коло воріт,",Ukranian
"і покликнувши спитали: Чи тут гостює Симон, на прізвище Петр?",Ukranian
"Коли ж думав Петр про видїннє, рече йому Дух: Ось три чоловіки шукають тебе.",Ukranian
"Уставши ж, зійди та йди з ними, не розбираючи; бо я післав їх.",Ukranian
"Зійшовши ж Петр до чоловіків, посланих до него від Корнелия, рече: Ось я, кого шукаєте? Що за причина, для котрої прийшли?",Ukranian
"Вони ж кажуть: Корнелий сотник, чоловік праведний, і богобоязливий, і доброї слави між усїм народом Жидівським, був наставлений від ангела сьвятого покликати тебе в господу свою і послухати словес від тебе.",Ukranian
"Закликавши ж їх, угостив. Назавтра ж вийшов Петр із ними, і деякі з братів з Йоппиї пійшли з ним.",Ukranian
"А другого дня увійшли в Кесарию. Корнелий же дожидав їх, скликавши родину свою і близьких приятелїв.",Ukranian
"Як же стало ся, що ввійшов Петр, зустрівши його Корнелий, упав у ноги та й уклонив ся.",Ukranian
"Петр же підвів його, говорячи: Встань; я таки же чоловік.",Ukranian
"І, розмовляючи з ним, увійшов, і знаходить многих, що посходились.",Ukranian
"І рече до них: Ви знаєте, що не годить ся чоловікові Жидовинові приставати або приходити до чужоземцїв; та мені Бог показав, щоб нїкого поганином або нечистим чоловіком не звав.",Ukranian
"Тим я, не відмовляючись, прийшов покликаний. Питаю ж оце, для чого покликали мене?",Ukranian
"І каже Корнелий; Четвертий день тому, як постив я аж до сієї години, а в девятій годині молив ся в дому моїм; і ось чоловік став передо мною в ясній одежї.",Ukranian
"і рече: Корнелию, вислухана твоя молитва, і милостині твої згадано перед Богом.",Ukranian
"Пішли ж в Йоппию та поклич Симона, що зветь ся Петром. Він гостює в господі в Симона кожемяки, над морем. Він, прийшовши, глаголати ме тобі.",Ukranian
"Зараз оце післав я до тебе, і добре зробив єси, прийшовши. Нинї ж усї ми перед Богом стоїмо, щоб слухати все, що звелено тобі від Бога.",Ukranian
"Відкривши ж Петр уста, рече: Поправдї постерегаю, що не на лице дивить ся Бог,",Ukranian
"а в кожному народі, хто боїть ся Його, і робить правду, приятен Йому.",Ukranian
"Слово, що післав синам Ізраїлевим, благовіствуючи впокій через Ісуса Христа(се Господь усіх);",Ukranian
"ви знаєте слово, що було по всій Юдеї, почавши від Гадилеї після хрещення, що проповідував Йоан,",Ukranian
"Про Ісуса з Назарета, як помазав Його Бог Духом сьвятим і силою, а котрий ходив, роблячи добро та сцїляючи всіх підневолених дияволом, бо Бог був з Ним.",Ukranian
"І ми сьвідки всього, що Він розбив і в землї Жидівській, і в Єрусалимі; котрого убили й повісили на дереві.",Ukranian
"Сього, воскресив Бог третього дня, і дав Йому статись явним",Ukranian
"не всьому народові, а сьвідкам наперед вибраним від Бога, - нам, що їли й пили з Ним по воскресенню Його з мертвих.",Ukranian
"І повелїв нам проповідувати народові і сьвідкувати, що Він призначений від Бога суддею живим і мертвим.",Ukranian
"Про Сього всї пророки сьвідкують, що всякий, хто вірує в Него, відпущеннє гріхів прийме через імя Його.",Ukranian
"Ще, як промовляв Петр слова сї, найшов Дух сьвятий на всіх, хто слухав його.",Ukranian
"І здивувались ті, що були від обрізання, котрі прийшли з Петром. що й на поган дар сьвятого Духа вилив ся.",Ukranian
"Чули бо їх, що розмовляли мовами і величали Бога. Тоді озвав ся Петр:",Ukranian
"Чи може хто боронити води, щоб оцім охреститись, котрі Духа сьвятого прийняли, як і ми?",Ukranian
"І звелів їм охреститись в імя Господнє. Тоді просили його, щоб пробув у них кілька днів.",Ukranian
"Почули ж апостоли та брати, котрі були в Юдеї, що й погане прийняли слово Боже.",Ukranian
"І як прийшов Петр у Єрусалим, змагались із ним ті, що від обрізання,",Ukranian
"кажучи: Що до людей, обрізання немаючих, ходив єси і їв з ними.",Ukranian
