Text,Language
"Хиба думаєте знов, що оправдуємось перед вами? Перед Богом у Христї глаголемо; усе ж, любі, на ваше збудуваннє.",Ukranian
"Боюсь бо, щоб иноді прийшовши, не знайшов вас не такими, як хочу, і щоб ви не знайшли мене таким, якого не хочете, щоб инодї (не було) змагання, зависти, досад, сварок, пересудів, нашептів, пихи, безладу,",Ukranian
"щоб, як прийду знов, не принизив мене Бог мій між вами, і щоб не оплакував многих, що перше згріши ли, та й не покаялись у нечистоті, й блудї, й розпусті, що коїли.",Ukranian
Се вже втрете йду до вас. При устах двох сьвідків або трох стане кожне слово.,Ukranian
"Наперед казав я вам і наперед кажу, мов би був перед вами вдруге, і тепер, не бувши між вами, пишу до тих, що перше згрішили, і до всїх инших, що, як прийду знов, то не пощаджу:",Ukranian
"бо ви шукаєте в менї доказу глаголючого в мені Христа, котрий до вас не немочний, а потужний в вас.",Ukranian
"Бо хоч і розпято Його від немощі, та живий Він од сили Божої. Бо хоч і ми немочні с Йому, та жити мемо з Ним од сили Божої в вас.",Ukranian
"Самих себе розбирайте, чи ви в вірі; самих себе вивідайте. Чи то ж не знаєте себе самих, що Ісус Христос у вас єсть? Хиба тільки, що ви недостойні.",Ukranian
"Сподїваю ся ж, що зрозумієте, що ми не недостойні.",Ukranian
"Молю ся ж Богу, щоб ви не зробили ніякого зла, не щоб ми хвальними явили ся, а щоб ви добре зробили, а ми яко нехвальні були.",Ukranian
"Нїчого бо не можемо проти правди, а за правду.",Ukranian
"Радуємось бо, коли ми немочні, ви ж сильні; про се ж і молимо ся на звершенне ваше.",Ukranian
"Тим то й не бувши між вами, пишу, щоб бувши між вами не зробив без'ощадно по властї, котру дав менї Господь на збудованнє, а не на руйнованне.",Ukranian
"На останок, браттє; радуйте ся, звершуйтесь, утішайтесь, те ж саме думайте, мирно живіть, то й Бог любови й миру буде з вами.",Ukranian
"Витайте один одного цїлуваннем сьвятим. Витають вас, усї сьвяті.",Ukranian
"Благодать Господа Ісуса Христа і любов Божа, і причастє сьвятого Духа з усїма вами. Амінь.",Ukranian
"Павел апостол (не від людей і не через чоловіка, а через Ісуса Христа й Бога Отця, що воскресив Його з мертвих),",Ukranian
"і все браттє, що зо мною, церквам Галацьким:",Ukranian
"Благодать вам і мир од Бога Отця і від Господа вашого Ісуса Христа,",Ukranian
"що віддав себе за гріхи наші, щоб збавити нас від сього віку лукавого, по волї Бога й Отця нашого,",Ukranian
котрому слава на віки вічні. Амінь.,Ukranian
"Дивуюсь, що так скоро одвернулись від покликавшого вас благодаттю Христовою на друге благовістє.",Ukranian
"Воно то не друге, та в такі, що вами колотять, і хочуть перевернути благовістє Христове.",Ukranian
"Та, коли б і ми або ангел з неба проповідував вам більш того, що ми проповідували вам, нехай буде анатема.",Ukranian
"Як перше рекли ми, так і тепер глаголю: коли хто благовіствує вам більш того, що ви прийняли, нехай буде анатема.",Ukranian
"Бо чи людей я тепер впевняю (шукаю), чи Бога? чи людям шукаю вгодити? Бо коли б я ще людям угождав, то не був би слугою Христовим.",Ukranian
"Звіщаю ж вам, браттє, що благовістє, благовіщене від мене, не єсть по чоловіку.",Ukranian
"Анї бо від чоловіка не прийняв я його, анї не навчивсь, а через одкриттє Ісуса Христа.",Ukranian
"Чували бо про життє мов колись у Жидівстві, що без міри гонив я церкву Божу, та руйнував її,",Ukranian
"і передував я в Жидівстві перед многими ровесниками народу мого, будучи аж надто ревнителем отцївських моїх переказів.",Ukranian
"Як же зводив Бог, що вибрав мене від утроби матери моєї, і покликав мене благодаттю своєю,",Ukranian
"відкрити в менї Сина свого, щоб я благовіствував Його між поганами, то зараз не радивсь я з тїлом і кровю,",Ukranian
"анї не вийшов у Єрусалим до тих, що були апостолами перш мене, а пійшов у Аравию, та й знов вернувсь у Дамаск.",Ukranian
"Потім через три роки пійшов я в Єрусалим, щоб побачитись із Петром, і пробув у нього пятнайцять день.",Ukranian
"Инших же апостолів я не видїв, тільки Якова, брата Господнього.",Ukranian
"Що ж пишу до вас, ось вам перед Богом, що не обманюю.",Ukranian
"Потім ходив я в сторони Сирські і Киликийські,",Ukranian
"був же незнаний лицем церквам Жидівським у Христї,",Ukranian
"а тільки чували, що гонивший нас колись тепер благовіствуе віру, що колись руйнував,",Ukranian
і прославляли у мені Бога.,Ukranian
"Потім, по чотирнайцятя лїтах, пійшов я знов у Єрусалим із Варнавою, взявши з собою й Тита.",Ukranian
"А пійшов я по відкриттю, і предложив їм благовісте, котре проповідую між поганами, тільки па самоті, значнішим, чи не марно я ходжу або ходив.",Ukranian
"Та й Тит, що був зо мною, не був, яко Грек, примушений обрізатись.",Ukranian
"А лжебратам, що крадькома ввійшли, щоб підгледіти волю нашу, що маємо в Христї Ісусї, щоб нас підневолити,",Ukranian
"ми анї на годину не поступились, порючись, щоб істина благовістя пробувала в вас",Ukranian
"Від тих же, що здають ся чим бути (які вони колись були, менї байдуже: Бог не дивить ся на лице чоловіка); ті (кажу), що здають ся чим бути), на мене нїчого не наложили.",Ukranian
"Нї, противно, зрозумівши, ще звірено менї благовісте необрізання, яко ж Петрові обрізання:",Ukranian
"(хто бо допоміг Петрові до апостольства обрізання, допоміг і менї між поганами;)",Ukranian
"і пізнавши благодать, дану менї, Яков, та КиФа, та Йоан, що здавали ся стовпами, дали правицї менї та Варнаві на товаришуванне, щоб ми (були) для поган, а вони для обрізання;",Ukranian
"тільки щоб ми вбогих памятали, про що й я дбав, щоб се чинити.",Ukranian
"Як же прийшов Петр в Антиохию, устав я проти него в вічі, бо заслужив докору.",Ukranian
"Перше бо нїм прийшли деякі від Якова, він їв з поганами; як же прийшли, таївсь і відлучавсь, боячись тих, що були з обрізання.",Ukranian
"Лицемірили з ним також і инші Жиди, так що й Варнава зведений був лицемірством їх.",Ukranian
"Та, як побачив я, що вони неправо ходять по євангелській істині, то я сказав Петрові перед усїма: коли ти, бувши Жидовином, живеш по-поганськи, а не пожидівськи, то на що примушуєш поган жити пожидівськи ?",Ukranian
"Ми по природі Жиди, а не грішника з поган;",Ukranian
"та знаючи, що не оправдуєть ся чоловік дїлами закону, а тільки вірою в Христа Ісуса, і ми увірували в Ісуса Христа, щоб справдитись вірою в Христа, а не дїлами закону; бо не справдить ся дїлами закову нїяке тїло.",Ukranian
"Коли ж, шукаючи справдитись у Христї, і самі явились грішниками, то чи Христос не служитель гріху? Нехай не буде!",Ukranian
"Бо коли я знов будую, що зруйнував, то переступником себе представляю.",Ukranian
"Я бо через закон законові умер, щоб жити Богові.",Ukranian
"Я рознятий з Христом; живу ж уже не я, а живе Христос у менї; а що живу тепер у тїлї, то живу вірою в Сина Божого, що полюбив мене і видав себе за мене.",Ukranian
"Не відкидаю благодати Божої; коли бо через закон праведність, то Христос марно вмер.",Ukranian
"Ой ви безумні Галати! хто вас очарував, щоб ви не корились правді, (ви) котрим перед очима наперед був прописаний Христос, рознятий між вами?",Ukranian
"Про одно се хочу довідатись од вас: Чи дїлами закону прийняли ви Духа, чи, слухаючи, проповіддю віри?",Ukranian
"Чи такі ви незмислі, що почавши духом, звершуєте тепер тїлом?",Ukranian
Марно стільки ви терпіли? Коли б тільки марно!,Ukranian
"Хто подає вам Духа і робить чудеса між вами, чи дїлами закону, чи проповіддю віри?",Ukranian
"Яко ж Авраам вірував у Бога, і полїчено йому за праведність.",Ukranian
"Знайте ж, що хто од віри, ті сини Авраамові.",Ukranian
"І писанне знаючи наперед, що Бог вірою оправдує поган, благовістило Авраамові: що в тобі благословлять ся всї народи.",Ukranian
"Тимже хто од віри, ті благословенні із вірним Авраамом.",Ukranian
"Которі ж од дїл закону, ті під клятьбою; писано бо: Проклят, хто не встоїть у всьому написаному в книаї закону, щоб робити те.",Ukranian
"А що нїхто законом не оправдуєть ся перед Богом, се явно, бо праведний вірою жив буде.",Ukranian
"Закон же не од віри, та которий чоловік робити ме те, жити ме в тому.",Ukranian
"Христос викупив нас од клятьби закону, ставшись за нас клятьбою, (писано бо: Проклят всяк, хто висить на дереві,)",Ukranian
"щоб на поган благословенне Авраамове прийшло в Христї Ісусї, щоб обітуванне Духа прийняли ми через віру.",Ukranian
"Браттє, по чоловічи глаголю; одначе чоловічого закону ствердженого нїхто не відкидав, анї додає до него.",Ukranian
"Авраамові ж виречені обітування і насїнню його. Не сказано: І насінням, яко про многі, а яко про одно: І насїнню твоєму, що єсть Христос.",Ukranian
"Оце ж глаголю, що завіту перше ствердженого від Бога про Христа, закон, що постав чотириста й трийцять лїт потім, не нехтує, так щоб обернути в ніщо обітуваннє.",Ukranian
"Бо коли від закону наслїддє, то вже не від обітування; Аврааму ж обітуваннєм дарував Бог.",Ukranian
"Що ж тодї закон? Задля переступів додано його, доки прийде насїнне, котрому обітувано; (і був він) уряджений через ангелів рукою посередника.",Ukranian
"Посередник же не єсть (посередник) одного, а Бог один.",Ukranian
"То хиба закон проти обітувань Божих? Нехай не буде! Бо коли б дано закон, що міг би оживляти, то справдї від закону була б праведність.",Ukranian
"Нї, зачинило писаннє усе під гріхом, щоб обітуваннє од віри Ісус-Христової дане було віруючим.",Ukranian
"Перше ж приходу віри, під законом стережено нас зачинених на віру, що мала відкритись.",Ukranian
"Тим же закон був нам учителем (щоб привести нас) до Христа, щоб вірою нам справдитись.",Ukranian
"Як же прийшла віра, то вже ми не під учителем.",Ukranian
Усї бо ви сини Божі вірою в Ісуса Христа.,Ukranian
"Скільки бо вас у Христа хрестилось, у Христа одягли ся.",Ukranian
"Нема Жидовина, нї Грека; нема невільника, нї вільного; нема муже-ського полу, нї женського: усї бо ви одно, в Христї Ісусї.",Ukranian
"Коди ж ви Христові, то ви насїнне Авраамове, і по обітованню наслїдники.",Ukranian
"Глаголю ж: доки наслїдник малолїток, доти не відрізняеть ся від слуги, хоч він і пан усього,",Ukranian
а єсть під опікунами та доморядниками аж до нароку отця.,Ukranian
"Так же й ми, як були малолітками, були підневолені первотинами сьвіта.",Ukranian
"Як же прийшла повня часу, послав Бог Сина свого, що родивсь від жени і був під законом,",Ukranian
"щоб викупив тих, що під законом, щоб ми прийняли всиновленнє.",Ukranian
"А що ви сини, то послав Бог Духа Сина свого в серця ваші, що покликує: Авва, Отче!",Ukranian
"Тимже вже більш не невільник єси, а син; коли ж син, то й наслїдник Божий через Христа.",Ukranian
"Тільки ж тодї, не знаючи Бога, служили ви тим, що не по природі були богами.",Ukranian
"Тепер же, знаючи Бога, більше ж будучи познані від Бога, як вертаєтесь до немочних та мізерних первотин, котрим знов наново служити хочете?",Ukranian
"Ви вважаєте на днї, місяцї, пори й лїта.",Ukranian
"Боюсь за вас, що може марно працював коло вас.",Ukranian
"Будьте, браттє, благаю вас, як і я: бо й я (такий), як ви. Нічим ви мене не скривдили.",Ukranian
"Ви ж знаєте, що я у немощі тїла благовістив вам перше.",Ukranian
"І не погордували ви спокусою, що була в тїлї моїм, анї відопхнули, а як ангела Божого прийняли мене, як Христа Ісуса.",Ukranian
"Яке ж то було блаженство ваше! Сьвідкую бо вам, що коли б можна, ви б тодї, вирвавши очі свої, оддали менї.",Ukranian
"То чи вже став я ворогом вам, говорячи вам правду?",Ukranian
"Ревнують про вас не добре, а хочуть відлучити вас, щоб ви про них ревнували.",Ukranian
"Добре ж ревнувати всякого часу в доброму, тай не тільки, як я приходжу до вас.",Ukranian
"Дїточки мої, (ви,) котрими знов мучусь (перед родинами), доки Христос з'образить ся у вас,",Ukranian
"хотїв би я бути у вас сьогоднї і змінити голос мій , бо я в непевности про вас.",Ukranian
"Скажіть менї, ви, що хочете бути під законом: хиба ви закону не слухаєте ?",Ukranian
"Писано бо, що Авраам мав два сини, одного від невольницї, а одного од вільної.",Ukranian
"Та що був од невольницї, родивсь по тілу, а що од вільної, по обітницї.",Ukranian
"Се ж иносказанне; се бо два завіти: один з гори Синая, що родить у неволю, котра єсть Агара.",Ukranian
"Бо Агара, се Синай, гора в Аравиї, прикладаеть ся ж до теперішнього Єрусалиму, і служить з дітьми своїми.",Ukranian
А вишній Єрусалим вільний; він мати всім нам.,Ukranian
"Писано бо: Звеселись, неплідна, що не роджаєш; гукай та покликуй, ти, що не мучилась; бо в одинокої багато дїтей, більш нїж у тієї, що має чоловіка.",Ukranian
"Ми ж, браттє, по Ісааку дїти обітування.",Ukranian
"Та, як тодї, хто родивсь по тілу, гонив того, хто по духу, так і тепер.",Ukranian
"Тільки ж бо що глаголе писаннє? Вижени невільницю й сина її, не має бо наслідувати син невільниці з сином вільної.",Ukranian
"Оце ж, браттє, ми не діти невільниці, а вільної.",Ukranian
"У волї ж оце, котрою Христос визволив нас, стійте, і під ярмо неволї знов не піддавайтесь.",Ukranian
"Ось я Павел глаголю вам, що коли ви обрізуєтесь, Христос вам нічого не поможе.",Ukranian
"Сьвідкую ж знов кожному чоловіку обрізаному, .що винен увесь закон чинити.",Ukranian
"Обернулись ви в нїщо (одійшовши) від Христа; (ви,) що оправдуєтесь законом, од благодати відпали.",Ukranian
Ми бо духом од віри надїї праведности ждемо.,Ukranian
"Бо в Христї Ісусї нї обрізаннє нїчого не може, нї необрізанне, а віра, любовю сильна.",Ukranian
Ви бігли добре. Хто заборонив вам коритись правді?,Ukranian
"Сей перекір не від того (приходить), хто покликав вас.",Ukranian
Трошки квасу все місиво квасить.,Ukranian
"Покладаюсь на вас у Господі, що не думати мете нїчого иншого, а хто колотить вами, понесе свій осуд, хто б він нї був.",Ukranian
"Я ж, браттє, коли ще проповідую обрізаннє, то чого ще гонять мене? Тодї обернеть ся в нїщо поблазнь хреста.",Ukranian
"Ой коли б відсічено тих, що колотять вами!",Ukranian
"Ви бо, браттє, покликані на волю; тільки щоб воля ваша не була причиною (до гріха) тїлу; а любовю служіть один одному.",Ukranian
"Увесь бо закон в одному слові сповняється: Люби ближнього твого, як себе самого.",Ukranian
"Коли ж ви гризете й заїдаєте один одного, то гледїть, щоб не були пожерті один від одного.",Ukranian
"Глаголю ж: Духом ходїть, і хотїння тілесного не звершуйте.",Ukranian
"Бо тіло бажає (того що) проти духа, а дух, (що) проти тїла; се ж одно другому противить ся, щоб не, що хочете, те робили.",Ukranian
"Коли ж водитесь духом, то ви не під законом.",Ukranian
"Явні ж дїла тілесні; оце вони: перелюб, блуд, нечистота, розпуст,",Ukranian
"ідолослуженнє, чаруваннє, ворогуваннє, свари, ненависть, гнїв, суперечки, незгода, ересї,",Ukranian
"зависть, убийство, пянство, бенкети й таке инше. Се наперед глаголю вам, яко ж і наперед глаголав, що хто таке робить, ті царства Божого не наслїдять.",Ukranian
"А овощ духа: любов, радощі, мир, довготерпінне, добрість, милосерде, віра,",Ukranian
"тихість, вдержливість. На таких нема закону.",Ukranian
"А которі Христові, ті розняли тіло з страстьми і хотїннем.",Ukranian
"Коли духом живемо, духом і ходімо.",Ukranian
"Не буваймо марнославні, один одного роздражнюючи і один одному завидуючи.",Ukranian
"Браттє, хоч і впаде чоловік у яке прогрішенне, ви, духовні, направляйте такого духом тихости, доглядаючи себе, що,б і тобі не бути спокушеним.",Ukranian
"Один одного тягарі носіть, і так сповняйте закон Христів.",Ukranian
"Коли бо хто думає, що він що єсть, бувши нїчим, сам себе обманює.",Ukranian
"Дїло ж своє нехай випробовує кожен, тоді хвалу в собі мати ме, а не в иншому.",Ukranian
Кожен бо свій тягар нести ме.,Ukranian
