Text,Language
"Книга родоводу Ісуса Христа, сина Давидового, сина Авраамового.",Ukranian
Авраам породив Ісаака; а Ісаак породив Якова; а Яков породив Юду та братів його;,Ukranian
а Юда породив Фареса та Зару від Тамари; а Фарес породив Єсрома; а Єсром породив Арама;,Ukranian
а Арам породив Аминадава; а Амннадав породив Насона; а Насон погодив Салмона;,Ukranian
а Салмон породив Вооза від Рахави; а Вооз породив Овида від Рути; а Овид породив Єссея;,Ukranian
а Єссей породив Давида царя; а Давид цар породив Соломона від Урієвої;,Ukranian
а Соломон породив Ровоама; а Ровоам породив Авію; а Авія породив Асу;,Ukranian
а Аса породив Йосафата; а Йосафат породив Йорама; а Йорам породив Озію;,Ukranian
а Озія породив Йоатама; а Йоатам породив Ахаза; а Ахаз породив Єзекію;,Ukranian
"а Єзекія породив Манассію, а Манассія породив Амона; а Амон породив Йосію;",Ukranian
"а Йосія породив Єхонїю та братів його, під час переселення у Вавилон;",Ukranian
"а після того, як переселено їх у Вавидон, Єхонїя породив Салатиїла, а Салатиїл породив Зоровавеля;",Ukranian
а Заровавель породив Авіюда; а Авіюд породив Єліякима; а бліяким породив Азора;,Ukranian
а Азор породив Садока; а Садок породив Ахима; а Ахим породив Єліюда;,Ukranian
а Єліюд породив Єліазара; а Єліазар породив Маттана; а Маттан породив Якова;,Ukranian
"а Яков породив ЙосиФа, чоловіка Мариїного, що від неї родивсь Ісус, на прізвище Христос.",Ukranian
То всїх родів од Авраама до Давида чотирнайцять родів; а від Давида до переселення у Вавилон чотирнайцять родів; і від переселення у Вавилон до Христа чотирнайцять родів.,Ukranian
"Різдво ж Ісуса Христа стало ся так. Скоро Його матїр Марию заручено Иосифові, перш ніж вони зійшли ся, постережено, що вона пала в утробі від сьвятого Духа.",Ukranian
"Йосиф же, чоловік її, будучи праведний, і не хотячи ославити її, хотїв був потай відпустити її.",Ukranian
"Та як він про се думав, аж ось явивсь йому вві снї ангел Господень, глаголючи: Йосифе, сину Давидів, не бій ся взяти до себе Марию, жінку твою; бо що в нїй зачалось, те від сьвятого Духа.",Ukranian
"І вродить вона сина, і даси йому імя Ісус; бо він спасе людей своїх од гріхів їх.",Ukranian
"Усе ж се стало ся, щоб справдилось, що промовив Господь через пророка, глаголючи:",Ukranian
"Ось дїва матиме в утробі, і вродить сина, і дадуть йому імя Емануіл, що перекладом є: 3 нами Бог.",Ukranian
"Прокинувшись тодї Йосиф од сна, зробив так, як ангел Господень повелїв йому, й узяв до себе жінку свою;",Ukranian
"і не знав її, аж поки вона вродила сина свого перворідня, і дав йому імя Ісус.",Ukranian
"Як же народивсь Ісус у Витлеемі Юдейському за царя Ірода, прийшли мудрцї зі сходу в Єрусалим,",Ukranian
"говорячи: Де нарождений цар Жидівський? бачили бо ми зорю його на сході, й прийшли поклонитись йому.",Ukranian
"Почувши ж цар Ірод, стрівожив ся, і ввесь Єрусалим із ним.",Ukranian
"І, зібравши всіх архиєреїв і письменників людьских, допитував ся в них, де Христу родити ся.",Ukranian
"Вони ж казали йому: В Витлеемі Юдейському, бо ось як написано в пророка:",Ukranian
"І ти, Витлееме, земле Юдина, нїчим не гірша єси між князями Юдиними; бо з тебе прийде гетьман, що страшинувати ме над народом моїм Ізраїлем.",Ukranian
"Закликавши тодї Ірод тайкома мудрцїв, пильно в них випитував, якого часу показалась зоря.",Ukranian
"І послав їх у Витлеєм, і каже: Йдїть та розпитайтесь пильно про те хлопятко; а як знайдете, принесіть менї звістку, щоб і мені пійти поклонитись йому.",Ukranian
"Вони ж, вислухавши царя, вийшли; коли се зоря, що бачили на сходї, йде поперед них, поки прийшла та й стала зверху, де було хлопятко.",Ukranian
"Побачивши ж вони зорю, зрадїли вельми великою радостю.",Ukranian
"І, ввійшовши в господу, знайшли хлопятко з Мариєю, матїрю його, й, припавши, поклонились йому; й, відкривши скарби свої, піднесли йому дари: золото, ладан і миро.",Ukranian
"І, бувши остережені вві снї, не вертатись до Ірода, вернулись в свою землю иншим шляхом.",Ukranian
"Як же вони вийшли, ось ангел Господень являєть ся Йосифові вві снї, глаголючи: Встань, візьми хлопятко й матір його, та втїкай в Єгипет, і перебудь там, поки сповіщу тебе; бо Ірод шукати ме хлопятка, щоб убити його.",Ukranian
"Він же, вставши, взяв хлопятко й матїр його в ночі, та й пійшов у Єгипет.",Ukranian
"І пробував там аж до смерти Іродової, щоб справдилось, що сказав Господь через пророка, глаголючи: Із Єгипту покликав я сина мого.",Ukranian
"Бачивши тоді Ірод, що мудрцї насьміялись із него, розлютував ся вельми, та й послав повбивати всїх дїтей у Витлеємі й у всіх гряницях його, од двох років і меньще, по тому часу, що про него він пильно довідував ся в мудрцїв.",Ukranian
"Тоді справдилось, що промовив Єремія пророк, глаголючи:",Ukranian
"Чути в Рамі голосїннє і плач і тяжке наріканнє: Рахила плаче по дітях своїх, і не дає розважати себе, бо їх нема вже.",Ukranian
"Як же вмер Ірод, ось являєть ся ангел Господень уві снї Йосифу в Єгиптї,",Ukranian
"глаголючи: Устань, та візьми хлопятко й матїр його, та йди в землю Ізраїлеву: бо ті померли, що шукали душі хлопятка.",Ukranian
"І встав він, і взяв хлопятко й матір його, та й пійшов у землю Ізраїлеву.",Ukranian
"Та, почувши, що Архелай царюв в Юдеї замість батька свого Ірода, побоявсь ійти туди; а, бувши остережений уві снї, звернув у сторони Галилейські:",Ukranian
"і, прийшовши, жив у городі, що його звали Назарет, щоб справдилось сказане в пророків: Що звати меть ся Назореєм.",Ukranian
"Того часу прийшов Йоан Хреститель, проповідуючи в пустинї Юдейській,",Ukranian
і глаголючи: Покайтесь: наближилось бо царство небесне.,Ukranian
"Се ж бо той, про кого казав пророк Ісаїя, глаголючи: Голос покликуючого в пустині: Приготовте дорогу Господню, правими робіть стежки Його.",Ukranian
"Сам же Йоан мав одежу свою з верблюжого волосу, й шкуряний пояс на поясниш своїй; а їдою його була сарана та дикий мед.",Ukranian
"Тодї виходили до него Єрусалим, і вся Юдея, і вся околиця Йорданська,",Ukranian
"і хрестились в Йордані від него, сповідаючи гріхи свої.",Ukranian
"Та, бачивши він, що багато Фарисеїв і Садукеїв приходило до хрещення його, сказав до них: Кодло гадюче, хто остеріг вас, щоб утікали від настигаючого гнїва?",Ukranian
Принесіть же овощ достойний покаяння;,Ukranian
"і не думайте казати в серці своєму: В нас батько Авраам; бо я вам важу, що Бог зможе з сього каміння підняти дїтей Авраамові.",Ukranian
"Вже ж і сокира коло кореня дерева лежить; тим кожне дерево, що не дає доброго овощу, зрубують, та й кидають ув огонь.",Ukranian
"Я оце хрещу вас водою на покаянне; а Той, що йде за мною, потужніщий від мене; недостоєн я Йому й обувя носити: Він вас хрестити ме Духом сьвятим та огнем.",Ukranian
"У руці в Него лопата, й перечистить Він тік свій, і збере пшеницю свою в клуню, а полову спалить огнем невгасимим.",Ukranian
"Приходить тоді Ісус із Галилеї на Йордан до Йоана, охреститись від него.",Ukranian
"Та Йоан не допускав Його, говорячи: Менї самому треба в Тебе хреститись, а Ти прийшов до мене?",Ukranian
"Відказуючи йому Ісус, рече до него: Допусти тепер, бо тав годиться нам чинити всяку правду. Тодї допустив Його.",Ukranian
"І охрестившись Ісус, вийшов зараз із води; й ось відчинилось Йому небо, і побачив він Духа Божого, що спустивсь як голуб, і злинув на Него.",Ukranian
"І ось голос із неба, глаголючи: Се мій Син любий, що я вподобав Його.",Ukranian
Тоді повів Ісуса дух у пустиню на спокусу дияволську.,Ukranian
"І постив він сорок днів і сорок ночей, потім забажав їсти.",Ukranian
"І прийшовши спокусник до Него, каже: Коли ти Син Божий, звели сим камінням зробитись хлїбом.",Ukranian
"Він же, озвавшись, сказав: Писано: Не самим хлїбом жити ме чоловік, а кожним словом, що виходить із уст Божих.",Ukranian
"Тоді диявол бере Його в сьвятий город, і ставить Його на церковнім крилі,",Ukranian
"І каже до Него: Коли ти Син Божий, кинь ся вниз, писано бо: Що накаже про Тебе ангелам своїм, і на руках понесуть Тебе, щоб не вдаривсь часом об камїнь ногою Твоєю.",Ukranian
"Рече йому Ісус: Писано знов: Не спокушуй Господа Бога твого,",Ukranian
"Знов бере Його диявол на гору височенну, й показує Йому всі царства на сьвітї й славу їх;",Ukranian
"і каже до Него: Оце все дам тобі, коли, припавши, поклониш ся менї.",Ukranian
"Рече тодї йому Ісус: Геть від мене, сатано! писано бо: Господу Богу твоєму кланяти меш ся, і Йому одному служити меш.",Ukranian
"Зоставив тоді Його диявол, і ось ангели приступили й служили Йому.",Ukranian
"Як же почув Ісус, що Йоана видано, то перейшов у Галилею;",Ukranian
"і, покинувши Назарет, пійшов і пробував у Капернауміу що при морю, у гряницях Завулона та Нефталима:",Ukranian
"щоб справдилось слово Ісаії пророка, глаголючого:",Ukranian
"Земля Завулон і земля Нефталим, на морському шляху, за Йорданом, Галидея поганська;",Ukranian
"люде сидячі в темряві побачили сьвітло велике, й тим, що сидять у країні й тїнї смертній, зассяло сьвітло.",Ukranian
"3 того часу почав Ісус проповідувати й глаголати: Покайтесь, наближилось бо царство небесне.",Ukranian
"І, йдучи Ісус попри море Галилейське, побачив двох братів, Симона, званого Петром, та Андрея, брата його, що закидали невід у море; були бо рибалки.",Ukranian
"І промовив до них: Ідїть за мною, то зроблю вас ловцями людськими.",Ukranian
"Вони ас зараз, покинувши неводи свої, пійшли слідом за Ним.",Ukranian
"І, йдучи звідтіля, побачив инших двох братів, Якова Зеведеєвого та Йоана, брата його, у човні з Зеведеем, батьком їх, як налагоджували неводи свої; і покликав їх.",Ukranian
"Вони ж зараз, покинувши човен і батька свого, пійшли слїдом за Ним.",Ukranian
"І ходив Ісус по всій Галилеї, навчаючи по школах їх, і проповідуючи евангелию царства, та сцїляючи всякий недуг і всякі болестї поміж людьми.",Ukranian
"І розійшлась чутка про Него по всїй Сирщинї; й приводжено до Него всїх недужнїх, що болїли всякими болещами та муками, й біснуватих, і місячників, і розслаблених; і сцїляв їх.",Ukranian
"І йшло за Ним пребагато народу з Галилеї, й з Десятиграду, й з Єрусалиму, й з Юдеї, й зза Йордану.",Ukranian
"Побачивши ж народ, зійшов на гору, і,як сїв, приступили до Него ученики Його;",Ukranian
"і відкрив Він уста свої, і навчав їх, глаголючи:",Ukranian
"Блаженні вбогі духом, бо їх царство небесне.",Ukranian
"Блаженні сумні, бо такі втїшять ся.",Ukranian
"Блаженні тихі, бо такі осягнуть землю.",Ukranian
"Блаженні голодні й жадні правди, бо такі наситять ся.",Ukranian
"Блаженні милостиві, бо такі будуть помилувані.",Ukranian
"Блаженні чисті серцем, бо такі побачять Бога.",Ukranian
"Блаженні миротворці, бо такі синами Божими звати муть ся.",Ukranian
"Блаженні, кого гонять за правду, бо їх царство небесне.",Ukranian
"Блаженні ви, коли вас безчестити муть, та гонити муть, та казати муть на вас усяке лихе слово не по правдї, ради мене.",Ukranian
"Радуйтесь і веселітесь: бо велика нагорода ваша на небі; так бо гонили й пророків, що бували перше вас.",Ukranian
"Ви сіль землї; коли ж сіль звітріє, то чим солити? Нї-на-що не годить ся тоді вона, тільки щоб викинути геть і щоб топтали її люде.",Ukranian
"Ви сьвітло сьвіту. Не може город сховати ся, стоячи на горі;",Ukranian
"і, засьвітивши сьвічку, не став лять під посудину, а на сьвічнику то й сьвітить вона всїм, хто в хатї.",Ukranian
"так нехай сяє сьвітло ваше перед людьми, щоб вони бачили ваші добрі дїла, й прославляли Отця вашого, що на небі.",Ukranian
"Не думайте, що я прийшов знївечити закон або пророків; не прийшов я знївечити, а сповнити.",Ukranian
"Істино бо глаголю вам: Доки перейде небо й земля, одна йота, або одна титла не перейде з закону, аж поки все станеть ся.",Ukranian
"Тим, хто поламле одну найменшу з сих заповідей і навчить так людей, той звати меть ся найменшим у царстві небесному; а хто сповнить і навчить, той звати меть ся великим у царстві небесному.",Ukranian
"Глаголю бо вам: Що коли ваша правда не переважить письменників та Фарисеїв, то не ввійдете в царство небесне.",Ukranian
"Чували ви, що сказано старосьвіцьким: Не вбий, а хто вбє, на того буде суд.",Ukranian
"вам глаголю: Хто сердить ся на брата свого без причини, на того буде суд; а хто скаже на брата свого: Рака [Безчесний], на того буде громадський суд; хто ж скаже: дурню, на того буде огонь пекельний.",Ukranian
"Тим, коли принесеш дар свій до жертівнї, й згадаєш там, що твій брат має що проти тебе;",Ukranian
"зостав свій дар перед жертівнею, і йди геть, помирись перш із братом твоїм, а тоді прийди й подай дар твій.",Ukranian
"Мирись із твоїм противником хутко, доки ти ще в дорозі з ним, щоб не віддав тебе противник судді, а суддя не віддав тебе осавулї (слузї), і не вкинуто тебе в темницю.",Ukranian
"Істино глаголю тобі: Не вийдеш звідтіля, доки не віддаси й останнього шеляга.",Ukranian
"Чували ви, що сказано старосьвіцьким: Не чини перелюбу.",Ukranian
"Я ж вам глаголю: Хто спогляне на жінку жадібним оком, той уже вчинив перелюб із нею в серці своїм.",Ukranian
"Коли ж око твоє праве блазнить тебе, вирви його, й кинь од себе; бо більша користь тобі, щоб один із членів твоїх згинув, а не все тіло вкинуто в пекло.",Ukranian
"І коли права рука твоя блазнить тебе відотни її, й кинь од себе; більша бо користь тобі, щоб один із членів твоїх згинув, а не все тіло твоє вкинуто в пекло.",Ukranian
"Сказано ж: Що хто розводить ся з жінкою своєю, нехай дасть їй розвідний лист.",Ukranian
"Я ж вам глаголю: Що хто розведеть ся з жінкою своєю, хиба що за перелюб, доводить її до перелюбу; й хто оженить ся з розвідкою, чинить перелюб.",Ukranian
"Знов чували, що сказано старосьвіцьким: Не кленись криво, а сповняй перед Господом обітниці твої.",Ukranian
"Я ж вам глаголю: Не клянїть ся зовсім: нї небом, бо воно престол Божий;",Ukranian
"нї землею, бо вона підніжок ніг Його; нї Єрусалимом, бо се город великого царя;",Ukranian
"нї головою твоєю не клянись, бо не зможеш зробити нї одного волоса білим або чорним.",Ukranian
"Слово ж ваще нехай буде: так, так; нї, нї; бо що більш над се, те від лихого.",Ukranian
"Чували ви, що сказано: Око за око, й зуб за зуб.",Ukranian
"Я ж вам глаголю: Не противтесь лихому, а хто вдарить тебе у праву щоку твою, повернись до него й другою.",Ukranian
"І хто схоче судитись із тобою і зняти з тебе свиту, віддай йому й жупанок.",Ukranian
"І хто силувати ме тебе йти милю, йди з ним дві.",Ukranian
"Дай, хто в тебе просить, і хто хоче в тебе позичити, не одвертайсь од него.",Ukranian
"Чували ви, що сказано: Люби ближнього твого, й ненавидь ворога твого.",Ukranian
"Я ж вам глаголю: Любіть ворогів ваших, благословляйте, хто клене вас, робіть добро, хто ненавидить вас, і моліть ся за тих, що обижають вас і гонять вас;",Ukranian
"щоб вам бути синами Отця вашого, що на небі; Він бо велить сонцю своєму сходити над лихими й над добрими, й посилає дощ на праведних і неправедних.",Ukranian
"Бо коли ви любите тих, що люблять вас, то за що вам нагорода? хиба й митники не те саме роблять?",Ukranian
"І коли витаєте тільки братів ваших, то що надто робите? хиба й митники не так роблять?",Ukranian
"Оце ж бувайте звершені, як Отець ваш, що на небі, звершений.",Ukranian
"Остерегайтесь подавати милостиню вашу перед людьми, щоб вони вас бачили; а то не мати мете ніякої нагороди від Отця вашого, що на небі.",Ukranian
